,id,host_response_rate,host_acceptance_rate,host_listings_count,host_total_listings_count,accommodates,bathrooms,bedrooms,beds,price,minimum_nights,maximum_nights,availability_30,availability_60,availability_365,number_of_reviews,number_of_reviews_ltm,number_of_reviews_l30d,review_scores_rating,review_scores_accuracy,review_scores_cleanliness,review_scores_checkin,review_scores_communication,review_scores_location,review_scores_value,reviews_per_month,last_scraped,name,description,neighborhood_overview,picture_url,host_name,host_since,host_about,host_response_time,host_is_superhost,host_verifications,host_has_profile_pic,host_identity_verified,neighbourhood,property_type,room_type,bathrooms_text,amenities,calendar_updated,has_availability,calendar_last_scraped,last_review,license,instant_bookable
16080,8.18e+17,1.0,1.0,5.0,6.0,4.0,1.5,1.0,2.0,1000.0,1.0,365,21,51,356,6.0,3.0,0.0,4.5,4.9,4.5,4.9,4.9,4.5,4.8,0.32,25/09/2024,"H02 habitación privada, a 8 minutos del aeropuerto","Create unforgettable memories at this unique and family home.<br />Very close to the airport of Terminal 1 and Terminal 2, 15 minutes from the historic center, 10 minutes from the Foro Sol, Sports Palace, Rodríguez Brothers Auditorium. <br />We are in a very quiet and safe area, we have all kinds of super close shops, food, drink, pharmacies, shopping centers, parks among many others.<br />We're guaranteed a great experience!",SIN INFORMACION,https://a0.muscache.com/pictures/miso/Hosting-818131148977173860/original/af89cb67-f218-4572-9b72-e37fd5508e24.jpeg,Guillermina,02/02/2023,SIN INFORMACIO,within a few hours,f,"['email', 'phone']",t,t,SIN INFORMACION,Shared room in home,Shared room,1.5 shared baths,"[""Wifi"", ""Pocket wifi"", ""Bed linens"", ""Free street parking"", ""Pets allowed"", ""Exterior security cameras on property""]",SIN INFORMACION,t,25/09/2024,24/08/2024,SIN INFORMACION,f
16159,8.24e+17,1.0,0.98,6.2,7.3,5.0,2.5,1.0,1.0,163.0,1.0,365,30,60,179,35.0,16.0,0.0,4.8,4.9,4.8,4.9,4.9,4.63,4.8,1.79,26/09/2024,Habitación Hostal Compartido amatlan condesa,Mixed hostel-type shared room in La Condesa one street from Tamaulipas.<br /><br />The room has 9 beds and is a house that has private and shared rooms in one of the best areas of Mexico City.<br />2.5 baths<br />WIFI<br />Hot water<br />Towels<br />Blankets,SIN INFORMACION,https://a0.muscache.com/pictures/miso/Hosting-823966034103686485/original/112527e4-9088-4d85-a600-9e1dc505bb12.jpeg,Andrea,14/09/2017,"Anfitriona en Airnbn desde hace 6 años , encantada de recibir huéspedes a mi casa o mis espacios. Dedicada en brindarles toda la ayuda que esté en mis manos para hacer su viaje lo más agradable posible ",within an hour,SIN INFORMACION,"['email', 'phone']",t,t,SIN INFORMACION,Shared room in home,Shared room,2.5 shared baths,"[""Iron"", ""Wifi"", ""Freezer"", ""Laundromat nearby"", ""Cleaning available during stay"", ""Gas stove"", ""Coffee maker: drip coffee maker"", ""Dishes and silverware"", ""Self check-in"", ""Blender"", ""Hangers"", ""Body soap"", ""Long term stays allowed"", ""First aid kit"", ""Essentials"", ""Hot water"", ""Dining table"", ""Coffee"", ""Bed linens"", ""Kitchen"", ""Outdoor dining area"", ""Books and reading material"", ""Drying rack for clothing"", ""Extra pillows and blankets"", ""Cleaning products"", ""Clothing storage"", ""Room-darkening shades"", ""Cooking basics"", ""Lockbox"", ""Hair dryer""]",SIN INFORMACION,t,26/09/2024,15/07/2024,SIN INFORMACION,t
16207,8.23e+17,1.0,1.0,2.0,3.0,1.0,1.0,1.0,1.0,399.0,1.0,365,29,59,364,6.0,1.0,0.0,4.8,4.9,4.5,5.0,4.83,4.67,4.8,0.31,25/09/2024,pequeño espacio para descansar,Enjoy the simplicity of this quiet and central accommodation.<br />it is a small private room <br />shared bathroom and kitchen,SIN INFORMACION,https://a0.muscache.com/pictures/37c6f091-437f-4cee-8c6e-daf8e7c25435.jpg,Liliana,19/01/2023,SIN INFORMACIO,within an hour,f,"['email', 'phone']",t,t,SIN INFORMACION,Shared room in rental unit,Shared room,1 shared bath,"[""Wifi"", ""Kitchen"", ""Refrigerator"", ""Dishes and silverware"", ""Essentials"", ""Hot water"", ""Cooking basics""]",SIN INFORMACION,t,25/09/2024,23/02/2024,SIN INFORMACION,f
16226,8.23e+17,1.0,1.0,13.0,13.0,1.0,2.0,1.0,1.0,450.0,1.0,15,22,33,332,5.0,0.0,0.0,5.0,5.0,5.0,5.0,5.0,5.0,5.0,0.26,25/09/2024,Cama en el centro histórico de la CDMX 4 Oaxaca,"Bedroom in the historic center of Mexico City. This place has a magnificent location just a 10-minute walk from the capital's Zócalo, very well located with easy access to the city's main public transport routes such as metro and metrobus",SIN INFORMACION,https://a0.muscache.com/pictures/7fad0802-1313-4344-a5a3-b8715ea6cdbd.jpg,Rodrigo,29/08/2022,SIN INFORMACIO,within an hour,f,"['email', 'phone']",t,t,SIN INFORMACION,Shared room in home,Shared room,2 shared baths,"[""Body soap"", ""Cleaning products"", ""Coffee maker"", ""Wifi"", ""Backyard"", ""Luggage dropoff allowed"", ""Coffee"", ""Patio or balcony"", ""41 inch HDTV"", ""Bed linens"", ""Long term stays allowed"", ""First aid kit"", ""Essentials"", ""Shampoo"", ""Hot water"", ""Smoking allowed"", ""Paid parking off premises""]",SIN INFORMACION,t,25/09/2024,17/08/2023,SIN INFORMACION,t
16233,8.26e+17,1.0,1.0,2.0,2.0,3.0,0.0,0.0,0.0,1511.6,1.0,365,0,0,0,0.0,0.0,0.0,4.8,4.8,4.8,4.8,4.8,4.8,4.7,1.7,26/09/2024,Recámara en departamento,"A beautiful, cozy apartment, in an excellent area, very close to Parque México",SIN INFORMACION,https://a0.muscache.com/pictures/miso/Hosting-826107324223698461/original/64764076-d672-4d67-8953-ad659315bf5c.jpeg,Cósima,07/08/2018,SIN INFORMACIO,SIN INFORMACION,f,"['email', 'phone']",t,t,SIN INFORMACION,Shared room in rental unit,Shared room,1 shared bath,"[""Fire extinguisher"", ""Wifi"", ""Kitchen""]",SIN INFORMACION,SIN INFORMACION,26/09/2024,SIN INFORMACION,SIN INFORMACION,f
16262,8.24e+17,1.0,1.0,6.2,7.3,1.0,1.2,1.0,1.0,175.0,1.6,365,10,40,345,1.0,1.0,0.0,5.0,5.0,5.0,5.0,5.0,5.0,5.0,0.15,25/09/2024,Habitación Compartida Cerca De IPN Zacatenco,"Shared room for students near National Polytechnic Institute and Metro Lindavista. <br />Student atmosphere, 2 kitchens, 6 bathrooms and a nice terrace.<br />If you like the place you can renew month.",SIN INFORMACION,https://a0.muscache.com/pictures/miso/Hosting-823803935143268318/original/1f64a5f3-3da5-494c-9e05-33e7139d6399.jpeg,Luis,04/08/2018,"Hello my friends, my house is very big and interesting, I always have guests from different parts of the world and therefore there is a very broad cultural exchange. The location is excellent because the Airport is 15 minutes from here and the downtown too. The Metrobus is around the corner, is very cheap to travel on it.",a few days or more,f,"['email', 'phone']",t,t,SIN INFORMACION,Shared room in guesthouse,Shared room,5 shared baths,"[""Shared patio or balcony"", ""Washer"", ""TV"", ""Wifi"", ""Fire extinguisher"", ""Kitchen"", ""Hammock"", ""First aid kit"", ""Long term stays allowed"", ""Exercise equipment"", ""Dedicated workspace"", ""Ping pong table"", ""BBQ grill: charcoal""]",SIN INFORMACION,t,25/09/2024,16/03/2024,SIN INFORMACION,f
16620,8.41e+17,1.0,1.0,3.0,4.0,6.0,2.0,1.0,1.4,400.0,1.0,1125,6,6,8,4.0,2.0,0.0,4.75,4.9,4.5,4.75,5.0,5.0,4.75,0.22,25/09/2024,Dormitorio compartido mixto de 6 camas,"We specialize in making your rest full, whether it's for a day or a few days.<br />You can choose a shared or private bedroom; also enjoy the 4 places to taste food.<br />Some reservations include breakfast","Located two blocks from Zócalo de la CDMX. In its surroundings there are museums, entertainment centers, department stores, transportation means such as the metro.",https://a0.muscache.com/pictures/miso/Hosting-841477499830862793/original/659a371e-754e-4706-a616-bd0dbe82a0e8.jpeg,De Los Reyes Hostal,06/03/2023,SIN INFORMACIO,within a few hours,f,"['email', 'phone']",t,t,"Mexico City, Ciudad de México, Mexico",Shared room in hostel,Shared room,2 shared baths,"[""TV"", ""Wifi"", ""Fire extinguisher"", ""Long term stays allowed"", ""First aid kit"", ""Dishes and silverware"", ""Essentials"", ""Exterior security cameras on property""]",SIN INFORMACION,t,25/09/2024,29/10/2023,SIN INFORMACION,t
16643,8.46e+17,1.0,1.0,13.0,13.0,1.0,2.0,1.0,1.0,450.0,1.0,15,22,33,332,1.0,0.0,0.0,5.0,5.0,5.0,4.9,5.0,4.9,5.0,0.05,25/09/2024,Cama en el centro histórico de CDMX 3 Veracruz,Enjoy the simplicity of this quiet and central accommodation.,SIN INFORMACION,https://a0.muscache.com/pictures/miso/Hosting-777009415519607501/original/408dda56-30f8-40dd-acd7-d1a017e9457c.jpeg,Rodrigo,29/08/2022,SIN INFORMACIO,within an hour,f,"['email', 'phone']",t,t,SIN INFORMACION,Shared room in home,Shared room,2 shared baths,"[""Wifi"", ""Freezer"", ""Cleaning available during stay"", ""Dishes and silverware"", ""Body soap"", ""Coffee maker"", ""Backyard"", ""Long term stays allowed"", ""First aid kit"", ""Essentials"", ""Shampoo"", ""Hot water"", ""Smoking allowed"", ""Luggage dropoff allowed"", ""TV"", ""Coffee"", ""Patio or balcony"", ""Bed linens"", ""Kitchen"", ""LG refrigerator"", ""Window guards"", ""Cleaning products"", ""Safe"", ""Clothing storage"", ""Otro induction stove"", ""Exterior security cameras on property"", ""Dedicated workspace"", ""Cooking basics"", ""Paid parking off premises""]",SIN INFORMACION,t,25/09/2024,19/03/2023,SIN INFORMACION,t
16673,8.47e+17,1.0,1.0,1.0,1.0,3.0,1.0,1.0,1.4,370.0,1.0,365,29,59,364,0.0,0.0,0.0,4.8,4.8,4.8,4.8,4.8,4.8,4.7,1.7,25/09/2024,Roomies UNAM,"Family-friendly, we support each other, sometimes we do activities to have fun, play a video game among the most things.",SIN INFORMACION,https://a0.muscache.com/pictures/c78c3877-261b-4a84-88fd-2f573cbe9993.jpg,Gera,16/03/2017,"Estatura media, color de piel claro, joven, ojos cafés, delgado.",a few days or more,f,"['email', 'phone']",t,t,SIN INFORMACION,Shared room in rental unit,Shared room,1 shared bath,"[""Washer"", ""TV"", ""Wifi"", ""Fire extinguisher"", ""Paid parking on premises"", ""Kitchen"", ""First aid kit"", ""Exterior security cameras on property"", ""Dedicated workspace"", ""Smoke alarm""]",SIN INFORMACION,t,25/09/2024,SIN INFORMACION,SIN INFORMACION,f
16960,8.62e+17,1.0,1.0,10.0,12.0,1.0,1.0,1.0,2.0,89.0,1.0,180,30,60,365,10.0,5.0,0.0,4.8,4.9,4.8,4.9,4.5,4.5,4.4,0.57,25/09/2024,IOW4 MED Yoga 1,"IOW4© CONCEPT TO SHARE TRIPS IN LUXURY AREAS IN COLIVING. ONLY FOR TRAVELERS WITH BROAD CRITERIA AND EXPERIENCED IN THE ECONOMY AND TRIPS AND WONDERFUL DESTINATIONS; DARING AND SOPHISTICATED, WHO LIKE TO EXTEND THE FUN FOR MORE DAYS AT THE BEST PRICE<br /><br />IMPORTANT <br />SINGLE BUNK BED IN THE ROOM, WITHOUT PRIVATE OR EXCLUSIVE AREAS<br /><br />ANGELES  LIVES HERE IS A REIKI THERAPIST, BIOMAGNETISM. THERAPIES ON STAY C DOLL<br /><br />IN EVERY SPACE #IOW4 YOUR HOME AND<br />IN EVERY HOME A SPACE #IOW4",SIN INFORMACION,https://a0.muscache.com/pictures/miso/Hosting-862410120295798438/original/42d3db9f-daaa-4c5d-b02c-629391e0a47b.jpeg,Ma. De Los Angeles,06/11/2018,Soy facilitadora de Bioenergética y Terapias de Biomagnetismo,within an hour,f,['phone'],t,t,SIN INFORMACION,Shared room in rental unit,Shared room,1 shared bath,"[""Backyard"", ""Wifi"", ""Patio or balcony"", ""Kitchen"", ""Refrigerator"", ""Dishes and silverware"", ""Self check-in"", ""Lockbox""]",SIN INFORMACION,t,25/09/2024,22/04/2024,SIN INFORMACION,t
16988,8.63e+17,1.0,1.0,10.0,12.0,1.0,1.0,1.0,2.0,89.0,1.0,180,20,50,355,4.0,1.0,0.0,4.8,4.9,4.8,4.9,4.9,4.9,4.8,0.23,25/09/2024,IOW4 MED Yoga 2,"IOW4© CONCEPT TO SHARE TRIPS IN LUXURY AREAS IN COLIVING. ONLY FOR TRAVELERS WITH BROAD CRITERIA AND EXPERIENCED IN THE ECONOMY AND TRIPS AND WONDERFUL DESTINATIONS; DARING AND SOPHISTICATED, WHO LIKE TO EXTEND THE FUN FOR MORE DAYS AT THE BEST PRICE<br /><br />IMPORTANT <br />SINGLE BUNK BED IN THE ROOM, WITHOUT PRIVATE OR EXCLUSIVE AREAS<br /><br />ANGELES IS A REIKI THERAPIST, BIOMAGNETISM. FROM THERAPY ON THE STAY WITH A DOLL. <br /><br /><br />IN EVERY SPACE #IOW4 YOUR HOME AND<br />IN EVERY HOME A SPACE #IOW4",SIN INFORMACION,https://a0.muscache.com/pictures/miso/Hosting-862410120295798438/original/8d7e5a76-8383-48c5-8677-af17bb507eaf.jpeg,Ma. De Los Angeles,06/11/2018,Soy facilitadora de Bioenergética y Terapias de Biomagnetismo,within an hour,f,['phone'],t,t,SIN INFORMACION,Shared room in rental unit,Shared room,1 shared bath,"[""Self check-in"", ""Lockbox"", ""Wifi"", ""Kitchen""]",SIN INFORMACION,t,25/09/2024,11/11/2023,SIN INFORMACION,t
17267,8.69e+17,1.0,1.0,11.0,13.0,1.0,1.0,1.0,1.0,362.0,1.0,1125,12,33,102,27.0,10.9,0.9,4.84,4.92,4.88,4.95,4.85,4.94,4.89,1.4,25/09/2024,Breakfast Included / Barrio Downtown Mexico City,"Our location in the heart of the city, ""El Centro"", makes everyone staying with us feel part of our culture from the first moment.<br />Breakfast courtesy, Wi-Fi.<br /><br />-Estadio GNP Seguros (Foro Sol), Autódromo Hnos. Rodríguez, Palacio de los Deportes (7.7 km)<br />-AICM 20 - 30 min - taxi (8.3 km)<br />-Torre Caballito (Av. P. Reforma)<br />-Teatro Metropólitan<br />-Haires Palace<br />-Zócalo CDMX<br /><br />We hope you have all the experiences we have ready for you!",SIN INFORMACION,https://a0.muscache.com/pictures/miso/Hosting-868912136914204649/original/2a5b3b9f-1cf1-4974-8e6d-097502af5037.jpeg,Barrio,23/08/2022,SIN INFORMACIO,within an hour,t,['phone'],t,t,SIN INFORMACION,Shared room in hostel,Shared room,1 shared bath,"[""Shared patio or balcony"", ""Wifi"", ""Exterior security cameras on property"", ""Dishes and silverware"", ""Self check-in"", ""Building staff"", ""Backyard"", ""Breakfast"", ""Long term stays allowed"", ""First aid kit"", ""Essentials"", ""Hot water"", ""Luggage dropoff allowed"", ""Bed linens"", ""Smoke alarm"", ""Safe"", ""Hair dryer"", ""Fire extinguisher"", ""Elevator"", ""Dedicated workspace"", ""Ping pong table"", ""Paid parking off premises"", ""Microwave""]",SIN INFORMACION,t,25/09/2024,24/09/2024,SIN INFORMACION,t
17526,8.89e+17,1.0,1.0,1.0,2.0,2.0,1.0,1.0,1.0,395.0,1.0,365,30,60,365,0.0,0.0,0.0,4.8,4.8,4.8,4.8,4.8,4.8,4.7,1.7,25/09/2024,rentó habitación cama escritorio,"Relax in this quiet and stylish space. <br />a gentleman's apartment. It has a kitchen, dining room, bathroom. It has all the amenities, including water, electricity, and internet.<br />the bedroom has a bunk bed. The bed upstairs is unoccupied, shared room, we are at your service 10 minutes by metro, you have transportation leaving🏠.",SIN INFORMACION,https://a0.muscache.com/pictures/90dca747-62c4-4a3a-a287-43346a376dee.jpg,Samuel,04/03/2023,SIN INFORMACIO,SIN INFORMACION,f,['phone'],f,t,SIN INFORMACION,Shared room in rental unit,Shared room,1 shared bath,"[""Wifi"", ""Outdoor shower"", ""Kitchen"", ""Outdoor dining area"", ""Exterior security cameras on property""]",SIN INFORMACION,t,25/09/2024,SIN INFORMACION,SIN INFORMACION,f
18151,9.12e+17,1.0,1.0,1.0,1.0,2.0,1.0,2.0,2.0,416.0,3.0,730,1,1,1,1.0,0.0,0.0,5.0,5.0,5.0,5.0,5.0,5.0,5.0,0.07,26/09/2024,"Habitación en departamento amueblado, compartido.","Water, electricity, gas and internet services. Amueblado (the only thing that the apartment does not have are closets, TV and parking box) parking at no cost on the street.<br />The apartment has a very good view from both bedrooms and living room as well as good light entrance, it is not cold, it has screens on all the windows. We have cameras in common areas and security personnel. Market across the street. All kinds of businesses, amenities and transportation very close.","It is a quiet neighborhood. I have lived here more than four years, I have left early in the morning and have never had a problem.<br />There are many things and places to visit for all tastes and budgets, everything is close and more cycling I leave 🚲🙂😃 you a little of my favorite places in my guidebook.",https://a0.muscache.com/pictures/miso/Hosting-912310606088359476/original/be91ebf5-a8ec-47fb-90bb-4a88ce94fbfd.jpeg,Arturo,12/06/2023,Soy una persona muy atenta y ordenada.,SIN INFORMACION,f,['phone'],t,t,"Mexico City, Ciudad de México, Mexico",Shared room in condo,Shared room,1 shared bath,"[""Wifi"", ""Freezer"", ""Laundromat nearby"", ""Host greets you"", ""Bikes"", ""Refrigerator"", ""Mosquito net"", ""Ethernet connection"", ""Dishes and silverware"", ""Exercise equipment"", ""Blender"", ""Portable fans"", ""Hangers"", ""Long term stays allowed"", ""First aid kit"", ""Essentials"", ""Hot water"", ""Dining table"", ""Paid parking lot on premises"", ""Outdoor playground"", ""Paid street parking off premises"", ""Luggage dropoff allowed"", ""Coffee"", ""Free dryer \u2013 In unit"", ""Bed linens"", ""Kitchen"", ""Oven"", ""Books and reading material"", ""Drying rack for clothing"", ""Stove"", ""Cleaning products"", ""Clothing storage"", ""Room-darkening shades"", ""Wine glasses"", ""Bread maker"", ""Free street parking"", ""Microwave"", ""Dedicated workspace"", ""Cooking basics"", ""Free washer \u2013 In unit"", ""Hair dryer""]",SIN INFORMACION,t,26/09/2024,02/08/2023,SIN INFORMACION,f
18360,9.2e+17,1.0,1.0,10.0,10.0,1.0,1.0,1.0,1.0,299.0,1.0,365,30,60,365,19.0,17.0,0.0,4.79,4.74,4.68,4.74,4.58,4.95,4.79,1.27,26/09/2024,Recamara compartida,"We are three blocks away from the Walk of the Reform and the Angel of Independence. You can be very close to the pink area, Colonia Condesa and Colonia Roma.",SIN INFORMACION,https://a0.muscache.com/pictures/miso/Hosting-919811802412031367/original/0770ddb8-e381-4176-8b88-89e9f5b6a454.jpeg,Diego Armando,04/05/2023,SIN INFORMACIO,within a day,f,['phone'],t,t,SIN INFORMACION,Shared room in home,Shared room,1 shared bath,"[""Wifi"", ""Kitchen""]",SIN INFORMACION,t,26/09/2024,16/07/2024,SIN INFORMACION,t
18386,9.21e+17,1.0,1.0,10.0,10.0,1.0,1.0,1.0,1.0,300.0,1.0,365,30,60,365,1.0,1.0,0.0,5.0,5.0,5.0,5.0,5.0,5.0,5.0,0.08,26/09/2024,Recámara compartida,"Enjoy the simplicity of this quiet, central home. We are a few blocks from the Angel, pink area and Chapultepec Castle, you can walk to Roma-Condesa",SIN INFORMACION,https://a0.muscache.com/pictures/miso/Hosting-919811802412031367/original/0770ddb8-e381-4176-8b88-89e9f5b6a454.jpeg,Diego Armando,04/05/2023,SIN INFORMACIO,within a day,f,['phone'],t,t,SIN INFORMACION,Shared room in home,Shared room,1 shared bath,"[""Wifi"", ""Kitchen""]",SIN INFORMACION,t,26/09/2024,03/10/2023,SIN INFORMACION,t
18670,9.33e+17,1.0,1.0,13.0,13.0,1.0,1.0,1.0,1.0,480.0,1.0,1125,30,58,267,38.0,35.0,5.0,4.92,4.89,4.71,4.97,4.84,4.92,4.89,2.64,26/09/2024,U-Co Roma Nomad Community - Shared Room,Your family will be close to everything when you stay at this centrally-located place.,SIN INFORMACION,https://a0.muscache.com/pictures/miso/Hosting-604198304758446635/original/f642f89e-849c-4966-b921-a9fabec65123.jpeg,Marco,21/12/2015,"I love to travel and experience different cultures. Currently, a digital nomad @marcobarrio exploring the world while growing my businesses. Founder of U-Co helping digital nomads find their community @uco.live DM me for collaborations.",within an hour,f,"['email', 'phone', 'work_email']",t,t,SIN INFORMACION,Shared room in guesthouse,Shared room,1 shared bath,"[""Iron"", ""Wifi"", ""Refrigerator"", ""Dishes and silverware"", ""Self check-in"", ""Hangers"", ""Body soap"", ""Coffee maker"", ""Backyard"", ""Hot water kettle"", ""Long term stays allowed"", ""Keypad"", ""First aid kit"", ""Essentials"", ""Shampoo"", ""Hot water"", ""Dining table"", ""Shower gel"", ""Luggage dropoff allowed"", ""TV"", ""Coffee"", ""Patio or balcony"", ""Bed linens"", ""Kitchen"", ""Stove"", ""Fire extinguisher"", ""Exterior security cameras on property"", ""Dedicated workspace"", ""Cooking basics"", ""Hair dryer"", ""Microwave""]",SIN INFORMACION,t,26/09/2024,10/09/2024,SIN INFORMACION,t
18698,9.34e+17,1.0,1.0,13.0,13.0,1.0,1.2,1.0,1.4,480.0,1.0,365,30,58,362,1.0,1.0,0.0,5.0,5.0,5.0,5.0,5.0,5.0,5.0,0.23,26/09/2024,U-Co Roma Nomad Community - Shared Room,"Relax <br />Welcome to our shared room with individual pods. Discover a modern and comfortable space designed for travelers looking for a unique experience. Each capsule will give you privacy with quality linens, personal storage, and reading lights. Enjoy common areas for socializing and experiences. Your safety is paramount with our rigorous hygiene measures. Come and have this unique experience with us! We look forward to visiting.",SIN INFORMACION,https://a0.muscache.com/pictures/miso/Hosting-934084870731223235/original/c5c49da9-7abd-4b56-8f9e-77d6f2c11e58.jpeg,Marco,21/12/2015,"I love to travel and experience different cultures. Currently, a digital nomad @marcobarrio exploring the world while growing my businesses. Founder of U-Co helping digital nomads find their community @uco.live DM me for collaborations.",within an hour,f,"['email', 'phone', 'work_email']",t,t,SIN INFORMACION,Shared room in home,Shared room,4 shared baths,"[""Iron"", ""Wifi"", ""Refrigerator"", ""Dishes and silverware"", ""Self check-in"", ""Body soap"", ""Coffee maker"", ""Backyard"", ""Keypad"", ""First aid kit"", ""Essentials"", ""Shampoo"", ""Hot water"", ""Shower gel"", ""Bed linens"", ""Kitchen"", ""Outdoor dining area"", ""60 inch HDTV with Netflix"", ""Fire extinguisher"", ""Clothing storage: wardrobe"", ""Exterior security cameras on property"", ""Dedicated workspace"", ""Cooking basics"", ""Hair dryer""]",SIN INFORMACION,t,26/09/2024,19/05/2024,SIN INFORMACION,t
18946,9.44e+17,1.0,1.0,11.0,13.0,1.0,1.0,1.0,1.0,362.0,1.0,365,19,49,118,77.0,10.9,4.0,4.94,4.94,4.96,4.99,4.88,4.95,4.96,1.4,25/09/2024,Breakfast Included / Barrio Downtown Mexico City,"Our location in the heart of the city, ""El Centro"", makes everyone staying with us feel part of our culture from the first moment.<br />Breakfast courtesy, Wi-Fi.<br /><br />-Estadio GNP Seguros (Foro Sol), Autódromo Hnos. Rodríguez, Palacio de los Deportes (7.7 km)<br />-AICM 20 - 30 min - taxi (8.3 km)<br />-Torre Caballito (Av. P. Reforma)<br />-Teatro Metropólitan<br />-Haires Palace<br />-Zócalo CDMX<br /><br />We hope you have all the experiences we have ready for you!",SIN INFORMACION,https://a0.muscache.com/pictures/miso/Hosting-944203720511739055/original/387e6bbc-852c-45a2-9010-31c401caafea.jpeg,Barrio,23/08/2022,SIN INFORMACIO,within an hour,t,['phone'],t,t,SIN INFORMACION,Shared room in hostel,Shared room,1 shared bath,"[""Shared patio or balcony"", ""Wifi"", ""Exterior security cameras on property"", ""Dishes and silverware"", ""Self check-in"", ""Building staff"", ""Backyard"", ""Breakfast"", ""Long term stays allowed"", ""First aid kit"", ""Essentials"", ""Hot water"", ""Luggage dropoff allowed"", ""Bed linens"", ""Smoke alarm"", ""Safe"", ""Fire extinguisher"", ""Paid parking lot off premises"", ""Elevator"", ""Dedicated workspace"", ""Ping pong table"", ""Hair dryer"", ""Microwave""]",SIN INFORMACION,t,25/09/2024,08/09/2024,SIN INFORMACION,t
18953,9.44e+17,1.0,1.0,1.0,1.0,1.0,1.0,0.0,1.0,1093.1,1.0,365,30,60,269,0.0,0.0,0.0,4.8,4.8,4.8,4.8,4.8,4.8,4.7,1.7,25/09/2024,Cuarto compartido,Reconnect with loved ones at this family-friendly place to stay.,SIN INFORMACION,https://a0.muscache.com/pictures/hosting/Hosting-944369067124746736/original/51083522-09fb-412b-953a-4f50650bc856.jpeg,Hugo Daniel,20/07/2018,SIN INFORMACIO,SIN INFORMACION,f,"['email', 'phone']",t,t,SIN INFORMACION,Shared room in home,Shared room,1 shared bath,"[""TV"", ""First aid kit""]",SIN INFORMACION,t,25/09/2024,SIN INFORMACION,SIN INFORMACION,f
