,id,host_response_rate,host_acceptance_rate,host_listings_count,host_total_listings_count,accommodates,bathrooms,bedrooms,beds,price,minimum_nights,maximum_nights,availability_30,availability_60,availability_365,number_of_reviews,number_of_reviews_ltm,number_of_reviews_l30d,review_scores_rating,review_scores_accuracy,review_scores_cleanliness,review_scores_checkin,review_scores_communication,review_scores_location,review_scores_value,reviews_per_month,last_scraped,name,description,neighborhood_overview,picture_url,host_name,host_since,host_about,host_response_time,host_is_superhost,host_verifications,host_has_profile_pic,host_identity_verified,neighbourhood,property_type,room_type,bathrooms_text,amenities,calendar_updated,has_availability,calendar_last_scraped,last_review,license,instant_bookable
115,617137.0,1.0,1.0,1.0,1.0,2.0,0.0,0.0,0.0,1511.6,1.0,1125,0,0,0,0.0,0.0,0.0,4.8,4.8,4.8,4.8,4.8,4.8,4.7,1.7,26/09/2024,Apt near Mexico City's downtown,SIN INFORMACION,SIN INFORMACION,https://a0.muscache.com/pictures/9187120/91a96265_original.jpg,Andoni,26/07/2012,Hi! Feel free to contact me if you have any inquiries about my listing. Thank you!,SIN INFORMACION,f,"['email', 'phone']",t,f,SIN INFORMACION,Shared room in rental unit,Shared room,1.5 shared baths,"[""Washer"", ""Wifi"", ""TV with standard cable"", ""Breakfast"", ""Kitchen""]",SIN INFORMACION,SIN INFORMACION,26/09/2024,SIN INFORMACION,SIN INFORMACION,f
258,3197924.0,1.0,1.0,3.0,8.0,1.0,1.5,2.0,2.0,640.0,2.0,365,30,60,364,0.0,0.0,0.0,4.8,4.8,4.8,4.8,4.8,4.8,4.7,1.7,26/09/2024,cuarto con terraza y uso general,"double bed , full bathroom, room with own terrace, PH new in colonia condesa, views of Trees in front of the Roof top, very ventilated, trees, new and complete kitchen, Roof Top private , parking place, Total Play spacious package included, wifi, dressing room, among the 3 best PH in condesa, 5 min walk to Parque México, super central in the heart of the countess, ecobici in front, all necessary services walking","Condesa is the main attraction in the city for its beautiful vegetation, restaurants, bars, parks, it is a small cosmopolitan town inhabiting foreigners from all over the world who have come to put their businesses or are digital nomads living with luxuries and services much more economical than in their countries",https://a0.muscache.com/pictures/miso/Hosting-3197924/original/b2ab187e-e8a7-49ca-9867-3954a1e41820.jpeg,Jordi,30/05/2014,muy bna persona espiritual deportista ,a few days or more,f,"['email', 'phone']",t,t,"Mexico City, Ciudad de México, Mexico",Shared room in loft,Shared room,1.5 shared baths,"[""Free parking on premises"", ""Washer"", ""TV"", ""Wifi"", ""Fire pit"", ""City skyline view"", ""Kitchen"", ""Outdoor dining area"", ""Dedicated workspace""]",SIN INFORMACION,t,26/09/2024,SIN INFORMACION,SIN INFORMACION,t
366,5434219.0,1.0,1.0,2.0,2.0,2.9,1.2,1.0,1.4,290.0,2.0,1125,28,55,360,34.0,6.0,2.0,4.44,4.74,4.47,4.74,4.71,4.71,4.59,0.3,26/09/2024,メキシコシティの革命記念塔付近のホステルです。,Single Room $30<br />Double room $60<br />Dormitory $15<br /><br />Public Transportation<br />30 minutes by taxi from the airport USD15.00 (MXN215.00)<br />As of February 2015<br /><br />Subway <br />Review 3min walk... see more<br /><br />メトロバス<br />PLAZA DE LA REPUBLICA 徒歩8分<br />BUENAVISTA 15,SIN INFORMACION,https://a0.muscache.com/pictures/67818853/31c70654_original.jpg,Tetsuo,22/02/2015,"DOMITORY 15USD PER PERSON
HABITACION SINGLE 30USD
HABITACION TWIN 45USD 

HOSTEL TRAVELSTATIONMEXICO",within a few hours,t,"['email', 'phone']",t,t,SIN INFORMACION,Shared room in guesthouse,Shared room,8 shared baths,"[""Iron"", ""Washer"", ""Wifi"", ""Refrigerator"", ""Dishes and silverware"", ""Carbon monoxide alarm"", ""Coffee maker"", ""Long term stays allowed"", ""Shampoo"", ""Hot water"", ""TV"", ""Patio or balcony"", ""Kitchen"", ""BBQ grill"", ""Smoke alarm"", ""Free street parking"", ""Exterior security cameras on property"", ""Cooking basics"", ""Hair dryer"", ""Microwave""]",SIN INFORMACION,t,26/09/2024,17/09/2024,SIN INFORMACION,f
444,6972071.0,1.0,1.0,6.2,7.3,2.9,1.2,1.0,1.4,1093.1,1.0,1125,30,60,365,0.0,0.0,0.0,4.8,4.8,4.8,4.8,4.8,4.8,4.7,1.7,25/09/2024,SUPER SAVER GROUP DEAL - PERFECT FOR STUDENTS,"Welcome to the best college-style dorms in a Boutique concept!<br /><br />We have available 100 beds in 15 dormitories, parquet floors, high ceilings, large windows with balcony colonial style. We have designed every dorm in a special, spacious and bright way.<br /><br />We are a unique hostel that boasts a fantastically social and cozy atmosphere, fully redesigned lobby area, a friendly staff, and a fabulous location. We have a kitchen, Wifi, and luggage storage, which means staying with us is a great value.",SIN INFORMACION,https://a0.muscache.com/pictures/69006e16-60f7-4303-80c0-9fe96947d961.jpg,Thor,09/06/2015,"Welcome, Airbnbers!

I am from Norway and raised in U.S.A. and Mexico City. As a global traveler & entrepreneur, I understand my guest's travel needs.  My passion for hospitality is based on offering: Prime location + Complimentary Housekeeping & Affordable = THE PERFECT STAY.

5 stars hospitality 
☆☆☆☆☆

I look forward to welcome you!

Thor",within a few hours,f,"['email', 'phone']",t,t,SIN INFORMACION,Shared room in hostel,Shared room,4 shared baths,"[""Carbon monoxide alarm"", ""Washer"", ""Wifi"", ""TV with standard cable"", ""Fire extinguisher"", ""Kitchen"", ""First aid kit"", ""Smoking allowed"", ""Smoke alarm""]",SIN INFORMACION,t,25/09/2024,SIN INFORMACION,SIN INFORMACION,f
456,6076798.0,1.0,0.94,2.0,2.0,2.9,3.0,1.0,1.4,550.0,1.0,1125,0,0,267,85.0,9.0,0.0,4.85,4.84,4.93,4.94,4.91,4.69,4.93,0.75,25/09/2024,Nova House,"It has all the comforts to rest if you come for work or travel, has a terrace with hammocks which makes it special. It is located near the historic center, airport and terminals. You can get to know a traditional and cheap neighborhood.","The neighborhood is popular where you can experience the Mexican culture of its streets and mainly food shops, and if you stay more than 2 nights you can shop in the supermarket to save money.",https://a0.muscache.com/pictures/0831e2e6-16f3-4ea6-b11d-5fa49cb82fa7.jpg,Antonio,17/04/2015,SIN INFORMACIO,within a few hours,t,"['email', 'phone', 'work_email']",t,t,"Mexico City, Distrito Federal, Mexico",Shared room in home,Shared room,3 shared baths,"[""Carbon monoxide alarm"", ""Washer"", ""Wifi"", ""Backyard"", ""TV with standard cable"", ""Patio or balcony"", ""Smoking allowed"", ""Kitchen"", ""First aid kit"", ""Refrigerator"", ""Dishes and silverware"", ""Essentials"", ""Free street parking"", ""Exterior security cameras on property"", ""Cooking basics"", ""Microwave""]",SIN INFORMACION,t,25/09/2024,26/02/2024,SIN INFORMACION,t
480,6312611.0,1.0,1.0,1.0,1.0,1.0,1.0,1.0,1.0,200.0,1.0,1125,28,58,363,0.0,0.0,0.0,4.8,4.8,4.8,4.8,4.8,4.8,4.7,1.7,25/09/2024,Sala de estar en DF,"Stay in our downtown brick apartment. It has a genuinely urban touch. At the moment I am not offering you a private room but it is ideal for you to sleep, bathe and make your belongings safe. Come on weekends and I give you an unforgettable tour! WELCOME.",We are close to everything! You can walk or bike to many sights. The subway and the subway bus are super close.,https://a0.muscache.com/pictures/78864685/fe533538_original.jpg,Héctor,27/04/2015,"Me gusta mucho la buena comida ya sea en algún lugar de moda, en un mercado, puesto de la calle o en algún lugar secreto. Disfruto mucho del cine, viajar, conocer gente nueva, el café, la cerveza, el mezcal, bailar, la música, los museos y el cine. Casi siempre ando en bici. ",SIN INFORMACION,f,"['email', 'phone']",t,t,"Mexico City, Distrito Federal, Mexico",Shared room in rental unit,Shared room,1 shared bath,"[""Wifi"", ""TV with standard cable"", ""Kitchen"", ""Essentials"", ""Shampoo""]",SIN INFORMACION,t,25/09/2024,SIN INFORMACION,SIN INFORMACION,f
537,7933584.0,1.0,0.97,1.0,2.0,2.9,1.2,1.0,1.4,300.0,1.0,1125,25,55,360,27.0,10.9,4.0,4.58,4.66,4.54,4.8,4.72,4.89,4.65,1.76,26/09/2024,Capsule Hostel Mexico City,"Unique concept in Mexico, inspired by the capsule hotels of Japan without losing the essence of a European hostel.We look for a way to have guests in shared rooms without losing their (URL HIDDEN) most of the rooms have climate","Attractives of Colonia Juárez<br /> It has a total catalogue of 249 buildings of architectural magnificence and artistic interest; 31 of them recognized for their historical value and 218 for architectural value.<br /> It has the Tourist corridor of the Paseo de la Reforma, and concentrates a lot of boutiques, hotels, bars, restaurants, art galleries, cafes, ants, bookstores, art galleries and offices<br /> Its location is excellent, as it has a vast public transport system to access it: by four Metro stations (Chapultepec, Sevilla, Insurgentes and Cuauhtémoc) also the Metrobus on line one that goes through Avenida Insurgentes (Reforma, Hamburg and Insurgentes stations), or through the Ecobus that runs along Reforma.",https://a0.muscache.com/pictures/101080125/a915f139_original.jpg,Rafael,18/08/2015,"hola soy una muy responsable y dedicada, busco la excelencia en mi vida, me gusta dejar el nombre de mi país en Alto, por tal motivo intento dar una experiencia inigualable a mis clientes.",within an hour,f,['phone'],t,t,"Mexico City, Distrito Federal, Mexico",Shared room in hostel,Shared room,5 shared baths,"[""Iron"", ""Carbon monoxide alarm"", ""Wifi"", ""Laundromat nearby"", ""Fire extinguisher"", ""Self check-in"", ""Essentials"", ""Shampoo"", ""Exterior security cameras on property"", ""Smoke alarm"", ""Building staff""]",SIN INFORMACION,t,26/09/2024,07/09/2024,SIN INFORMACION,f
931,11964525.0,1.0,1.0,1.0,1.0,2.0,1.0,1.0,2.0,1093.1,1.6,34,30,60,365,0.0,0.0,0.0,4.8,4.8,4.8,4.8,4.8,4.8,4.7,1.7,25/09/2024,Cuarto con Tv y gran ubicación,"It is a room in the heart of South Rome, because of the location of the apartment you always see the best sunsets.<br />All amenities are available: Wifi +TV+Refrigerator one bed ( and an extra mattress) is steps from the metro and metrobus","There are two supermarkets that you can walk to, a shopping mall called Delta Park that you also walk to, and in general there are many restaurants and bars to visit in the area.",https://a0.muscache.com/pictures/15f8b547-f582-42b3-9e38-d6902c7c54bc.jpg,Eli Duarte,21/03/2016,"Hola! Me llamo Eli, trabajé 5 años en marketing digital en México, ahora estoy estudiando en Irlanda y me encanta la idea de viajar por el mundo.

Trabajo en proyectos relacionados a la educación el arte y periodismo.",SIN INFORMACION,f,"['email', 'phone']",t,t,"Mexico City, Distrito Federal, Mexico",Shared room in rental unit,Shared room,1 shared bath,"[""Iron"", ""Wifi"", ""TV with standard cable"", ""Kitchen"", ""First aid kit"", ""Essentials"", ""Shampoo"", ""Pets allowed"", ""Smoking allowed""]",SIN INFORMACION,t,25/09/2024,SIN INFORMACION,SIN INFORMACION,f
1063,13221271.0,1.0,1.0,6.2,7.3,2.9,1.0,1.0,1.4,1093.1,1.0,1125,28,58,363,0.0,0.0,0.0,4.8,4.8,4.8,4.8,4.8,4.8,4.7,1.7,25/09/2024,Boutique Hostel lifestyle. Cheap & Chic.,"Welcome, to the best value for groups of up to 28 guests. Unbeatable Location, near all points of interest: museums, historic monuments, shopping.<br /><br />Where love for art, culture, and hosting merge!","As the development of the historic center of Mexico City for decades impaired with respect to their economic, aesthetic and commercial, the building had exactly the same evolution over the years, was built between the eighteenth and nineteenth centuries , its original use in the early history home house money just as later spin as trade, warehouse and workshop which is then used as offices and training center.",https://a0.muscache.com/pictures/ca326a24-28cf-4ea2-821d-c8c5b8a9a90b.jpg,Thor,09/06/2015,"Welcome, Airbnbers!

I am from Norway and raised in U.S.A. and Mexico City. As a global traveler & entrepreneur, I understand my guest's travel needs.  My passion for hospitality is based on offering: Prime location + Complimentary Housekeeping & Affordable = THE PERFECT STAY.

5 stars hospitality 
☆☆☆☆☆

I look forward to welcome you!

Thor",within a few hours,f,"['email', 'phone']",t,t,"Ejido del Centro, Ciudad de México, Mexico",Shared room in hostel,Shared room,1 shared bath,"[""Dryer"", ""Washer"", ""Carbon monoxide alarm"", ""Wifi"", ""Fire extinguisher"", ""Kitchen"", ""First aid kit"", ""Essentials"", ""Shampoo"", ""Smoking allowed"", ""Smoke alarm"", ""Hangers""]",SIN INFORMACION,t,25/09/2024,SIN INFORMACION,SIN INFORMACION,f
1095,13293812.0,1.0,1.0,1.0,2.0,2.0,1.0,1.0,1.0,222.0,1.0,1125,30,60,89,2.0,0.0,0.0,4.5,4.9,4.5,4.5,4.5,5.0,5.0,0.02,25/09/2024,Cuarto para estudiantes FES ZARAGO,"Comfortable rooms (2) for students, two beds, half bathroom, study area, services included. Close to UNAM FES ZARAGOZA.<br /><br />On the ground floor there is an inexpensive kitchen. It offers delicious dishes at an affordable price.",SIN INFORMACION,https://a0.muscache.com/pictures/8538a3d8-184e-432b-8063-4c4b50706450.jpg,Alejandro,24/05/2016,SIN INFORMACIO,a few days or more,f,"['email', 'phone']",t,t,SIN INFORMACION,Shared room in home,Shared room,1 shared bath,"[""Wifi"", ""Essentials""]",SIN INFORMACION,t,25/09/2024,03/08/2019,SIN INFORMACION,t
1202,13622872.0,1.0,1.0,23.0,26.0,4.0,1.0,1.0,2.0,918.0,1.0,1125,24,48,84,13.0,1.0,0.0,4.69,4.85,4.92,4.92,4.92,4.92,4.77,0.15,25/09/2024,"Rento habitación  ""Éxito""",Places of interest: Near corporate and shopping centers. You'll love my place because you'll save yourself the traffic when entering and exiting the area. My place is good for adventurers and business travelers.<br />We have surveillance cameras in the public areas for guest protection,SIN INFORMACION,https://a0.muscache.com/pictures/40dbc609-d1aa-44cf-8e11-008cfbd1f43d.jpg,Jorge,23/11/2015,"Arquitecto empresario  especialista desde hace quince años en técnicas taoistas  y filosofías budistas y tántricas,  facilitador en meditación merkaba, geometría y arquitectura sagradas de lo cual imparte cursos, terapeuta quántico, maestro de yoga y primer grado iniciático en la gran fraternidad universal, Coach certificado . Tercer Dan en Tae Kwon Do 
Profesor certificado en Zhineng Qi Gong Ming Jue y Terapeuta de Vidas Pasadas
Amigable, espiritual y servicial.",within an hour,f,"['email', 'phone']",t,t,SIN INFORMACION,Shared room in home,Shared room,1 shared bath,"[""Iron"", ""Wifi"", ""Refrigerator"", ""Dishes and silverware"", ""Self check-in"", ""Dishwasher"", ""Hangers"", ""Free parking on premises"", ""Coffee maker"", ""Paid washer \u2013 In unit"", ""Long term stays allowed"", ""First aid kit"", ""Essentials"", ""Hot water"", ""Luggage dropoff allowed"", ""Pocket wifi"", ""TV with standard cable"", ""Kitchen"", ""Oven"", ""Smoke alarm"", ""Stove"", ""Fire extinguisher"", ""Paid dryer \u2013 In unit"", ""Free street parking"", ""Microwave"", ""Cooking basics"", ""Building staff""]",SIN INFORMACION,t,25/09/2024,06/12/2023,SIN INFORMACION,t
1461,15165035.0,1.0,1.0,1.0,1.0,3.0,0.0,0.0,0.0,1511.6,1.0,1125,0,0,0,0.0,0.0,0.0,4.8,4.8,4.8,4.8,4.8,4.8,4.7,1.7,26/09/2024,Citta San Jerónimo apartamento,Apartment in citta san Jerónimo great development for business or pleasure just 5 minutes from Santa Fe,SIN INFORMACION,https://a0.muscache.com/pictures/9e12eb4f-64b3-4115-a131-e49a3aee2cd4.jpg,Carlo,21/09/2016,SIN INFORMACIO,SIN INFORMACION,f,['phone'],t,f,SIN INFORMACION,Shared room in rental unit,Shared room,1 shared bath,"[""Free parking on premises"", ""Pool"", ""Kitchen"", ""Gym"", ""Elevator""]",SIN INFORMACION,SIN INFORMACION,26/09/2024,SIN INFORMACION,SIN INFORMACION,f
1587,16011942.0,1.0,1.0,7.0,7.0,1.0,1.0,1.0,1.4,250.0,1.0,7,30,60,90,54.0,1.0,0.0,4.52,4.57,4.8,4.79,4.77,4.65,4.63,0.57,25/09/2024,Single bed  in a dormitory,"We are 15 minutes away by car from the Airport and 35 minutes from  ""Mexico´s down town"" by subway",The best area to taste tradicional mexicane cuisine at really affordable prices. Better than attend to restaurants or the uptown with inflated prices and fewer variety.,https://a0.muscache.com/pictures/miso/Hosting-16011942/original/3fa28354-4df8-45b1-b6e3-0a3603977a2b.jpeg,Diego,25/09/2016,Soy una persona tranquila que goza de viajar cuando puedo. Trabajo en un hotel asi que me gusta atender a mis huespdes con lo mejor que me han enseñado en mi empleo. Espero  poder ofrecerte algo de tu agrado.,within an hour,f,"['email', 'phone']",t,t,"Mexico City, Ciudad de México, Mexico",Shared room in guest suite,Shared room,1 shared bath,"[""Extra pillows and blankets"", ""Body soap"", ""Carbon monoxide alarm"", ""Luggage dropoff allowed"", ""Wifi"", ""Lockbox"", ""Fire extinguisher"", ""Bathtub"", ""Bed linens"", ""Self check-in"", ""Essentials"", ""Free street parking"", ""Shampoo"", ""Hot water"", ""Pets allowed"", ""Dedicated workspace"", ""Smoke alarm"", ""Paid parking off premises""]",SIN INFORMACION,t,25/09/2024,19/11/2023,SIN INFORMACION,f
1597,16032189.0,1.0,1.0,7.0,7.0,1.0,1.0,1.0,1.4,250.0,1.0,7,30,60,90,3.0,0.0,0.0,4.8,4.9,4.8,4.67,4.9,4.9,4.8,0.03,25/09/2024,Cama individual en habitación compartida,"Single bed in a triple room. If you only wanted the room for yourself, ask me for a special offer!","Excellent gastronomic offer in the area , on the hill there are something eocnomic to 9 pesos a tacos to cakes of 80 giant pesos. Pozole, enchiladas, whatever you want",https://a0.muscache.com/pictures/miso/Hosting-16032189/original/ade2466d-0783-414d-8285-fdaf06e16031.jpeg,Diego,25/09/2016,Soy una persona tranquila que goza de viajar cuando puedo. Trabajo en un hotel asi que me gusta atender a mis huespdes con lo mejor que me han enseñado en mi empleo. Espero  poder ofrecerte algo de tu agrado.,within an hour,f,"['email', 'phone']",t,t,"Mexico City, Ciudad de México, Mexico",Shared room in home,Shared room,1 shared bath,"[""Carbon monoxide alarm"", ""Wifi"", ""Free carport on premises \u2013 1 space"", ""Patio or balcony"", ""Essentials"", ""Shampoo"", ""Hot water"", ""Pets allowed"", ""Smoke alarm""]",SIN INFORMACION,t,25/09/2024,26/11/2022,SIN INFORMACION,f
1976,17964379.0,1.0,1.0,3.0,3.0,1.0,0.0,0.0,0.0,1511.6,1.0,1125,0,0,0,0.0,0.0,0.0,4.8,4.8,4.8,4.8,4.8,4.8,4.7,1.7,26/09/2024,Habitación sencilla dentro de casa,For one person only,SIN INFORMACION,https://a0.muscache.com/pictures/57c71653-36d5-49c8-8da5-7c3f6f0ec3f1.jpg,Humberto,04/01/2017,SIN INFORMACIO,SIN INFORMACION,f,"['email', 'phone']",t,f,SIN INFORMACION,Shared room in home,Shared room,1 shared bath,[],SIN INFORMACION,SIN INFORMACION,26/09/2024,SIN INFORMACION,SIN INFORMACION,f
2073,18451165.0,1.0,1.0,1.0,1.0,2.0,0.0,0.0,0.0,1511.6,1.0,1125,0,0,0,0.0,0.0,0.0,4.8,4.8,4.8,4.8,4.8,4.8,4.7,1.7,26/09/2024,Excelente cuarto zona sur CDMX,"Excellent apartment with 1 bedroom for accommodation for  2 people in the southern CDMX area with coffee service and excellent kitchen to enjoy a rich comfort or a rich cup of coffee in front of an 80""screen and pleasant ambient music","Museums, easy access, car rental",https://a0.muscache.com/pictures/1327dac0-8d6e-4fb0-aaa4-25ab4f133796.jpg,Israel,21/04/2017,Buen anfitrión. Cordial y amable  ,SIN INFORMACION,f,"['email', 'phone']",t,f,"Mexico City, Ciudad de México, Mexico",Shared room in rental unit,Shared room,1 shared bath,"[""Self check-in"", ""Smoking allowed"", ""Pets allowed"", ""Building staff""]",SIN INFORMACION,SIN INFORMACION,26/09/2024,SIN INFORMACION,SIN INFORMACION,f
2188,19037182.0,1.0,1.0,1.0,1.0,2.0,1.0,1.0,2.0,2029.0,2.0,1125,23,53,91,16.0,0.0,0.0,4.88,5.0,5.0,5.0,4.94,4.75,4.94,0.19,25/09/2024,HABITACIÓN CON SERVICIOS INCLUIDOS,"Spacious room, a double and single bunk bed. Full bathroom, electricity, water, internet, included. Preferred monthly rent for a single occupant. Towels, microwave oven, espresso coffee maker, sandwich maker are included. American breakfast can be included x $70mxn x person. You have independent access to the room from the street. Close to Tlacotal metrobus stations and Coyuya metro. 20 min (walking) from Foro Sol, Brothers Rodriguez Racetrack, Sports Palace.",SIN INFORMACION,https://a0.muscache.com/pictures/5f71bf47-87fa-4897-b31d-1cc5bf4596d1.jpg,Nelson,25/10/2015,"Ingeniero de servicio técnico. 
Viajero frecuente y aventurero ",SIN INFORMACION,f,"['email', 'phone']",t,t,SIN INFORMACION,Shared room in rental unit,Shared room,1 shared bath,"[""Extra pillows and blankets"", ""Luggage dropoff allowed"", ""Coffee maker"", ""Wifi"", ""Fire extinguisher"", ""Bed linens"", ""Long term stays allowed"", ""Essentials"", ""Shampoo"", ""Hot water"", ""Pets allowed"", ""Single level home"", ""Microwave""]",SIN INFORMACION,t,25/09/2024,27/02/2023,SIN INFORMACION,f
2264,19333425.0,1.0,1.0,2.0,2.0,2.0,0.0,0.0,0.0,1511.6,1.6,1125,0,0,0,0.0,0.0,0.0,4.8,4.8,4.8,4.8,4.8,4.8,4.7,1.7,26/09/2024,"Casa de estudiantes (UPN, COLMEX y UNAM)","Furnished rooms for students are rented.<br />The rooms have 2 double beds, 2 buros and 2 closets.<br />Great location for living with shops, pharmacies, transportation, etc.<br />Including water, electricity, internet, gas and cleaning services.<br />Bedding and cooking utensils are provided, they can make use of the washer and dryer.","it's a safe space during the day, and we have everything close by, but it's recommended not to be out after 10pm",https://a0.muscache.com/pictures/1bed80e9-849e-42e6-b919-9f2b6d08c8b5.jpg,Roman Ernesto,21/11/2016,Estudiante de maestría.  Me gusta andar en bici y los video juegos. Me gusta el ecoturismo.,SIN INFORMACION,f,"['email', 'phone']",t,f,"Mexico City, Ciudad de México, Mexico",Shared room in home,Shared room,1.5 shared baths,"[""Washer"", ""Wifi"", ""Cleaning available during stay"", ""Host greets you"", ""Refrigerator"", ""Dishes and silverware"", ""Hangers"", ""Coffee maker"", ""Long term stays allowed"", ""Hot water"", ""Dryer"", ""Luggage dropoff allowed"", ""TV"", ""Babysitter recommendations"", ""Pocket wifi"", ""Game console"", ""Patio or balcony"", ""Bed linens"", ""Kitchen"", ""Oven"", ""Stove"", ""Extra pillows and blankets"", ""Free street parking"", ""Microwave"", ""Cooking basics""]",SIN INFORMACION,SIN INFORMACION,26/09/2024,SIN INFORMACION,SIN INFORMACION,f
2506,20833518.0,1.0,1.0,1.0,3.0,2.0,0.0,0.0,0.0,1511.6,2.0,6,0,0,0,1.0,0.0,0.0,5.0,5.0,5.0,5.0,5.0,5.0,5.0,0.01,26/09/2024,Excelente habitación en departamento,"apartment with excellent atmosphere, with living/dining room, kitchen, full bathroom, three bedrooms (one already inhabited), good lighting in all spaces, fifty meters from the normal metro station.",SIN INFORMACION,https://a0.muscache.com/pictures/74dda210-c43e-49b2-97ae-88321f4e24c8.jpg,Nathan,06/09/2017,SIN INFORMACIO,SIN INFORMACION,f,"['email', 'phone']",t,f,SIN INFORMACION,Shared room in rental unit,Shared room,1 shared bath,"[""Wifi"", ""Kitchen"", ""Hangers""]",SIN INFORMACION,SIN INFORMACION,26/09/2024,20/11/2017,SIN INFORMACION,f
2591,21314149.0,1.0,1.0,1.0,1.0,1.0,0.0,0.0,0.0,1511.6,1.0,1125,0,0,0,0.0,0.0,0.0,4.8,4.8,4.8,4.8,4.8,4.8,4.7,1.7,26/09/2024,Depto céntrico CD MX,"Downtown apartment 10 minutes from downtown Mexico City. Accessible room (bus, train station). <br /><br />Services:<br />Internet, <br />Televsion, <br />Breakfast, <br />lunch and <br />dinner.<br /><br />Accessible area.",I live in the downtown area of the city. The place is very  central and safe. There is surveillance (video cameras),https://a0.muscache.com/pictures/cd2eba88-6a8b-401d-9f14-2684e81a933d.jpg,Luis,04/05/2014,"Soy una persona que disfruta viajar, conocer gente, ayudar a los turistas. Puedes revisarmos referencias  mi perfil de couchsurfing  es:

couchsurfing.com/people/luiszamora

Sientete libre de preguntarme cualquier día antes de hacer tu reserva",SIN INFORMACION,f,['email'],t,f,"Mexico City, Ciudad de México, Mexico",Shared room in rental unit,Shared room,1 shared bath,"[""Washer"", ""TV"", ""Wifi"", ""Heating"", ""Breakfast"", ""Kitchen"", ""First aid kit"", ""Essentials"", ""Shampoo"", ""Microwave"", ""Smoking allowed""]",SIN INFORMACION,SIN INFORMACION,26/09/2024,SIN INFORMACION,SIN INFORMACION,f
2678,21451591.0,1.0,1.0,6.0,8.0,1.0,1.0,1.0,1.0,600.0,2.0,1125,24,53,358,8.0,1.0,1.0,4.75,4.88,4.88,5.0,4.88,5.0,4.75,0.1,25/09/2024,Colchoneta dentro de nuestra sala BAÑO COMPARTIDO,"Buenvenido!! ❤️I tell you that our armchair is of standard dimension and you may be higher, please specify it 🤗<br />There is the possibility of a mattress on the floor  (please specify)<br />Access to refrigerator and microwave oven.<br />Ideal for express travelers, only if you want to get to sleep and leave for your concert, this possibility we enable it for backpackers is 🎒not comfortable to rest 24 hrs since we make normal house movements that can affect your rest😘",SIN INFORMACION,https://a0.muscache.com/pictures/97dc17ea-0e1d-4f17-babd-063c14b39c3f.jpg,Shannthall,25/07/2015,Hola soy mexicana llevo 8 años hosteando en airbnb me gusta viajar y convivir :) ,within a few hours,f,"['email', 'phone']",t,t,SIN INFORMACION,Shared room in rental unit,Shared room,1 shared bath,"[""Iron"", ""Hair dryer"", ""TV"", ""Wifi"", ""Coffee maker"", ""Host greets you"", ""Refrigerator"", ""Dishes and silverware"", ""Hot water"", ""Dedicated workspace"", ""Cooking basics"", ""Hangers""]",SIN INFORMACION,t,25/09/2024,21/09/2024,SIN INFORMACION,f
