,id,host_response_rate,host_acceptance_rate,host_listings_count,host_total_listings_count,accommodates,bathrooms,bedrooms,beds,price,minimum_nights,maximum_nights,availability_30,availability_60,availability_365,number_of_reviews,number_of_reviews_ltm,number_of_reviews_l30d,review_scores_rating,review_scores_accuracy,review_scores_cleanliness,review_scores_checkin,review_scores_communication,review_scores_location,review_scores_value,reviews_per_month,last_scraped,name,description,neighborhood_overview,picture_url,host_name,host_since,host_about,host_response_time,host_is_superhost,host_verifications,host_has_profile_pic,host_identity_verified,neighbourhood,property_type,room_type,bathrooms_text,amenities,calendar_updated,has_availability,calendar_last_scraped,last_review,license,instant_bookable
9340,48595057.0,1.0,1.0,6.2,7.3,1.0,1.2,1.0,1.0,168.0,1.6,365,30,60,180,4.0,0.0,0.0,4.5,4.9,4.8,4.75,4.75,5.0,4.8,0.12,25/09/2024,Habitaciones compartidas fácil acceso a metrobus,"Hello friends, you will like my house very much, it is very large  and interesting, I always have guests from different parts of the world and so there is a very wide cultural exchange. The atmosphere is very pleasant. You will meet at my house with guests from several continents.<br /><br />We are in an excellent location close to the city center and we have the Metrobus around.",SIN INFORMACION,https://a0.muscache.com/pictures/miso/Hosting-48595057/original/3b4663fb-e9bd-491b-845a-2a97f0208331.jpeg,Luis,04/08/2018,"Hello my friends, my house is very big and interesting, I always have guests from different parts of the world and therefore there is a very broad cultural exchange. The location is excellent because the Airport is 15 minutes from here and the downtown too. The Metrobus is around the corner, is very cheap to travel on it.",a few days or more,f,"['email', 'phone']",t,t,SIN INFORMACION,Shared room in home,Shared room,5 shared baths,"[""Iron"", ""Outdoor furniture"", ""Wifi"", ""Freezer"", ""Refrigerator"", ""Dishes and silverware"", ""Ethernet connection"", ""Self check-in"", ""Hangers"", ""Body soap"", ""Free washer \u2013 In building"", ""Coffee maker"", ""Backyard"", ""Long term stays allowed"", ""First aid kit"", ""Essentials"", ""Shampoo"", ""Hot water"", ""Smoking allowed"", ""Clothing storage: closet"", ""Luggage dropoff allowed"", ""TV"", ""Pocket wifi"", ""Patio or balcony"", ""Bed linens"", ""Board games"", ""Kitchen"", ""Outdoor dining area"", ""Drying rack for clothing"", ""Stove"", ""Fire extinguisher"", ""Free street parking"", ""Microwave"", ""Dedicated workspace"", ""Cooking basics"", ""Hair dryer"", ""Building staff""]",SIN INFORMACION,t,25/09/2024,01/05/2022,SIN INFORMACION,f
9341,48595475.0,1.0,1.0,6.2,7.3,1.0,3.0,1.0,1.0,168.0,1.6,365,30,60,180,0.0,0.0,0.0,4.8,4.8,4.8,4.8,4.8,4.8,4.7,1.7,25/09/2024,Bienvenidos! Habitación Compartida,"Hello friends, you will like my house very much, it is very large  and interesting, I always have guests from different parts of the world and so there is a very wide cultural exchange. The atmosphere is very pleasant. You will meet at my house with guests from several continents.<br /><br />We are in an excellent location close to the city center and we have the Metrobus around.",SIN INFORMACION,https://a0.muscache.com/pictures/miso/Hosting-48595475/original/abb6a52c-3729-44f3-8d7b-96417426a650.jpeg,Luis,04/08/2018,"Hello my friends, my house is very big and interesting, I always have guests from different parts of the world and therefore there is a very broad cultural exchange. The location is excellent because the Airport is 15 minutes from here and the downtown too. The Metrobus is around the corner, is very cheap to travel on it.",a few days or more,f,"['email', 'phone']",t,t,SIN INFORMACION,Shared room in home,Shared room,3 shared baths,"[""Iron"", ""Wifi"", ""Refrigerator"", ""Dishes and silverware"", ""Ethernet connection"", ""Self check-in"", ""Hangers"", ""Body soap"", ""Free washer \u2013 In building"", ""Coffee maker"", ""Backyard"", ""Long term stays allowed"", ""First aid kit"", ""Essentials"", ""Shampoo"", ""Hot water"", ""Smoking allowed"", ""Dining table"", ""Luggage dropoff allowed"", ""TV"", ""Pocket wifi"", ""Patio or balcony"", ""Bed linens"", ""Board games"", ""Kitchen"", ""Outdoor dining area"", ""Drying rack for clothing"", ""Stove"", ""Fire extinguisher"", ""Clothing storage"", ""Free street parking"", ""Microwave"", ""Dedicated workspace"", ""Cooking basics"", ""Hair dryer"", ""Building staff""]",SIN INFORMACION,t,25/09/2024,SIN INFORMACION,SIN INFORMACION,f
9350,48595542.0,1.0,1.0,6.2,7.3,1.0,1.2,1.0,1.0,168.0,1.6,365,30,60,365,2.0,0.0,0.0,5.0,5.0,5.0,5.0,5.0,5.0,5.0,0.05,25/09/2024,Bienvenidos! Habitacion Compartida,"Hello friends, you will like my house very much, it is very large  and interesting, I always have guests from different parts of the world and so there is a very wide cultural exchange. The atmosphere is very pleasant. You will meet at my house with guests from several continents.<br /><br />We are in an excellent location close to the city center and we have the Metrobus around.",SIN INFORMACION,https://a0.muscache.com/pictures/f9e5bacf-5429-46d5-9ae5-e03acc4d7184.jpg,Luis,04/08/2018,"Hello my friends, my house is very big and interesting, I always have guests from different parts of the world and therefore there is a very broad cultural exchange. The location is excellent because the Airport is 15 minutes from here and the downtown too. The Metrobus is around the corner, is very cheap to travel on it.",a few days or more,f,"['email', 'phone']",t,t,SIN INFORMACION,Shared room in home,Shared room,5 shared baths,"[""Iron"", ""Outdoor furniture"", ""Wifi"", ""Freezer"", ""Refrigerator"", ""Dishes and silverware"", ""Ethernet connection"", ""Self check-in"", ""Hangers"", ""Body soap"", ""Free washer \u2013 In building"", ""Coffee maker"", ""Backyard"", ""Long term stays allowed"", ""First aid kit"", ""Essentials"", ""Shampoo"", ""Hot water"", ""Smoking allowed"", ""Dining table"", ""Luggage dropoff allowed"", ""TV"", ""Pocket wifi"", ""Patio or balcony"", ""Bed linens"", ""Board games"", ""Kitchen"", ""Outdoor dining area"", ""Drying rack for clothing"", ""Stove"", ""Fire extinguisher"", ""Clothing storage"", ""Free street parking"", ""Microwave"", ""Dedicated workspace"", ""Cooking basics"", ""Hair dryer"", ""Building staff""]",SIN INFORMACION,t,25/09/2024,14/08/2021,SIN INFORMACION,f
9360,48888151.0,1.0,1.0,1.0,1.0,3.0,1.0,1.0,0.0,1093.1,1.0,365,30,60,365,0.0,0.0,0.0,4.8,4.8,4.8,4.8,4.8,4.8,4.7,1.7,25/09/2024,"Habitación - Departamento, en condominio privado","Quiet, downtown and safe place.",SIN INFORMACION,https://a0.muscache.com/pictures/45735726-ced0-450e-a2c7-1a65a6a7f2d6.jpg,Ernesto,30/05/2019,SIN INFORMACIO,SIN INFORMACION,f,"['email', 'phone']",t,t,SIN INFORMACION,Shared room in condo,Shared room,1 shared bath,"[""Body soap"", ""Washer"", ""TV"", ""Wifi"", ""Smoking allowed"", ""Bed linens"", ""Kitchen"", ""Shampoo"", ""Hot water"", ""Cooking basics""]",SIN INFORMACION,t,25/09/2024,SIN INFORMACION,SIN INFORMACION,t
9381,48946081.0,1.0,1.0,6.2,7.3,1.0,3.0,1.0,1.0,199.0,1.6,365,30,60,365,0.0,0.0,0.0,4.8,4.8,4.8,4.8,4.8,4.8,4.7,1.7,25/09/2024,Habitación Compartida (Shared Room),"Hello friends, my house will like you very much, it is very large  and interesting, I always have guests from different parts of the world and therefore there is a very wide cultural exchange. The atmosphere is very pleasant. You will find yourself at my house with guests from various continents.<br /><br />We are in a great location near downtown and we have the Metrobus around the corner.",SIN INFORMACION,https://a0.muscache.com/pictures/f9e5bacf-5429-46d5-9ae5-e03acc4d7184.jpg,Luis,04/08/2018,"Hello my friends, my house is very big and interesting, I always have guests from different parts of the world and therefore there is a very broad cultural exchange. The location is excellent because the Airport is 15 minutes from here and the downtown too. The Metrobus is around the corner, is very cheap to travel on it.",a few days or more,f,"['email', 'phone']",t,t,SIN INFORMACION,Shared room in home,Shared room,3 shared baths,"[""Iron"", ""Washer"", ""Wifi"", ""Refrigerator"", ""Ethernet connection"", ""Self check-in"", ""Hangers"", ""Body soap"", ""Coffee maker"", ""Backyard"", ""Long term stays allowed"", ""First aid kit"", ""Essentials"", ""Shampoo"", ""Hot water"", ""Smoking allowed"", ""Dining table"", ""Luggage dropoff allowed"", ""TV"", ""Pocket wifi"", ""Patio or balcony"", ""Bed linens"", ""Board games"", ""Kitchen"", ""Outdoor dining area"", ""Drying rack for clothing"", ""Stove"", ""Fire extinguisher"", ""Clothing storage"", ""Free street parking"", ""Microwave"", ""Dedicated workspace"", ""Cooking basics"", ""Hair dryer"", ""Building staff""]",SIN INFORMACION,t,25/09/2024,SIN INFORMACION,SIN INFORMACION,f
9393,48976336.0,1.0,1.0,6.2,7.3,1.0,3.0,1.0,1.0,199.0,1.6,365,30,60,365,0.0,0.0,0.0,4.8,4.8,4.8,4.8,4.8,4.8,4.7,1.7,25/09/2024,Shared rooms near downtown!,"You will like my house very much, my house is big and very interesting since there are many foreigners from other countries in the world. The atmosphere is very nice.<br /><br />We are in an excellent location near downtown and next to the Metrobus.",SIN INFORMACION,https://a0.muscache.com/pictures/0382f145-f986-406d-bc1c-166863114f39.jpg,Luis,04/08/2018,"Hello my friends, my house is very big and interesting, I always have guests from different parts of the world and therefore there is a very broad cultural exchange. The location is excellent because the Airport is 15 minutes from here and the downtown too. The Metrobus is around the corner, is very cheap to travel on it.",a few days or more,f,"['email', 'phone']",t,t,SIN INFORMACION,Shared room in home,Shared room,3 shared baths,"[""Iron"", ""Washer"", ""Outdoor furniture"", ""Wifi"", ""Freezer"", ""Laundromat nearby"", ""Refrigerator"", ""Dishes and silverware"", ""Ethernet connection"", ""Self check-in"", ""Hangers"", ""Body soap"", ""Backyard"", ""Long term stays allowed"", ""First aid kit"", ""Essentials"", ""Shampoo"", ""Hot water"", ""Smoking allowed"", ""Luggage dropoff allowed"", ""TV"", ""Pocket wifi"", ""Patio or balcony"", ""Bed linens"", ""Kitchen"", ""Outdoor dining area"", ""Drying rack for clothing"", ""Stove"", ""Fire extinguisher"", ""Clothing storage"", ""Free street parking"", ""Microwave"", ""Dedicated workspace"", ""Cooking basics"", ""Hair dryer"", ""Building staff""]",SIN INFORMACION,t,25/09/2024,SIN INFORMACION,SIN INFORMACION,f
9395,48979220.0,1.0,1.0,6.2,7.3,1.0,3.0,1.0,1.0,199.0,1.6,365,30,60,365,0.0,0.0,0.0,4.8,4.8,4.8,4.8,4.8,4.8,4.7,1.7,25/09/2024,Shared rooms near downtown!,"You will like my house very much, my house is big and very interesting since there are many foreigners from other countries in the world. The atmosphere is very nice.<br /><br />We are in an excellent location near downtown and next to the Metrobus.",SIN INFORMACION,https://a0.muscache.com/pictures/0382f145-f986-406d-bc1c-166863114f39.jpg,Luis,04/08/2018,"Hello my friends, my house is very big and interesting, I always have guests from different parts of the world and therefore there is a very broad cultural exchange. The location is excellent because the Airport is 15 minutes from here and the downtown too. The Metrobus is around the corner, is very cheap to travel on it.",a few days or more,f,"['email', 'phone']",t,t,SIN INFORMACION,Shared room in home,Shared room,3 shared baths,"[""Iron"", ""Washer"", ""Outdoor furniture"", ""Wifi"", ""Freezer"", ""Laundromat nearby"", ""Refrigerator"", ""Dishes and silverware"", ""Ethernet connection"", ""Self check-in"", ""Hangers"", ""Body soap"", ""Backyard"", ""Long term stays allowed"", ""First aid kit"", ""Essentials"", ""Shampoo"", ""Hot water"", ""Smoking allowed"", ""Luggage dropoff allowed"", ""TV"", ""Pocket wifi"", ""Patio or balcony"", ""Bed linens"", ""Kitchen"", ""Outdoor dining area"", ""Drying rack for clothing"", ""Stove"", ""Fire extinguisher"", ""Clothing storage"", ""Free street parking"", ""Microwave"", ""Dedicated workspace"", ""Cooking basics"", ""Hair dryer"", ""Building staff""]",SIN INFORMACION,t,25/09/2024,SIN INFORMACION,SIN INFORMACION,f
9408,48984372.0,1.0,1.0,6.2,7.3,1.0,1.2,1.0,1.0,168.0,1.6,365,30,60,365,1.0,0.0,0.0,5.0,5.0,4.8,5.0,5.0,5.0,5.0,0.03,25/09/2024,Habitación Compartida en CDMX cerca Metrobus,"Hello friends, you will like my house very much, it is very large  and interesting, I always have guests from different parts of the world and so there is a very wide cultural exchange. The atmosphere is very pleasant. You will meet at my house with guests from several continents.<br /><br />We are in an excellent location close to the city center and we have the Metrobus around.",SIN INFORMACION,https://a0.muscache.com/pictures/miso/Hosting-48984372/original/b39736d8-b79b-4369-afad-c99f3365462c.jpeg,Luis,04/08/2018,"Hello my friends, my house is very big and interesting, I always have guests from different parts of the world and therefore there is a very broad cultural exchange. The location is excellent because the Airport is 15 minutes from here and the downtown too. The Metrobus is around the corner, is very cheap to travel on it.",a few days or more,f,"['email', 'phone']",t,t,SIN INFORMACION,Shared room in home,Shared room,5 shared baths,"[""Iron"", ""Washer"", ""Outdoor furniture"", ""Wifi"", ""Freezer"", ""Laundromat nearby"", ""Refrigerator"", ""Dishes and silverware"", ""Ethernet connection"", ""Self check-in"", ""Hangers"", ""Body soap"", ""Coffee maker"", ""Backyard"", ""Long term stays allowed"", ""First aid kit"", ""Essentials"", ""Shampoo"", ""Hot water"", ""Smoking allowed"", ""Dining table"", ""Luggage dropoff allowed"", ""TV"", ""Pocket wifi"", ""Patio or balcony"", ""Bed linens"", ""Board games"", ""Kitchen"", ""Outdoor dining area"", ""Drying rack for clothing"", ""Stove"", ""Fire extinguisher"", ""Clothing storage"", ""Free street parking"", ""Microwave"", ""Dedicated workspace"", ""Cooking basics"", ""Hair dryer"", ""Building staff""]",SIN INFORMACION,t,25/09/2024,30/06/2021,SIN INFORMACION,f
9411,48994995.0,1.0,1.0,1.0,3.0,1.0,1.0,1.0,1.0,1093.1,2.0,365,30,60,180,0.0,0.0,0.0,4.8,4.8,4.8,4.8,4.8,4.8,4.7,1.7,25/09/2024,"Recámara en departamento compartido, NARVARTE",SIN INFORMACION,SIN INFORMACION,https://a0.muscache.com/pictures/74401ba8-ab61-4a0d-9993-541a85f5dae6.jpg,Jessica,22/12/2017,SIN INFORMACIO,SIN INFORMACION,f,"['email', 'phone']",t,t,SIN INFORMACION,Shared room in serviced apartment,Shared room,1 shared bath,"[""Dryer"", ""Iron"", ""Washer"", ""TV"", ""Wifi"", ""Elevator"", ""Heating"", ""Hot tub"", ""Breakfast"", ""Kitchen"", ""Essentials"", ""Shampoo"", ""Hot water"", ""Dedicated workspace"", ""Hair dryer""]",SIN INFORMACION,t,25/09/2024,SIN INFORMACION,SIN INFORMACION,t
9648,49778181.0,1.0,1.0,6.2,7.3,1.0,1.2,1.0,1.0,168.0,1.6,365,9,39,344,2.0,0.0,0.0,5.0,5.0,5.0,5.0,5.0,5.0,5.0,0.05,25/09/2024,"""Habicación Compartida Metrobus Cerca""","Hello friends, you will like my house very much, it is large  and interesting, there are always guests from different parts of the world, so there is a very wide cultural exchange. The atmosphere is very pleasant. You'll meet guests from several continents.<br /><br />We are in a great location near downtown and have around the Metrobuses of Line 1 to get from North to South of the city, with many ferries along the line with Metros and Metrobuses all over the city.",SIN INFORMACION,https://a0.muscache.com/pictures/miso/Hosting-49778181/original/b776a656-3bad-4aee-963f-0a67636d2fda.jpeg,Luis,04/08/2018,"Hello my friends, my house is very big and interesting, I always have guests from different parts of the world and therefore there is a very broad cultural exchange. The location is excellent because the Airport is 15 minutes from here and the downtown too. The Metrobus is around the corner, is very cheap to travel on it.",a few days or more,f,"['email', 'phone']",t,t,SIN INFORMACION,Shared room in home,Shared room,4 shared baths,"[""Iron"", ""Washer"", ""Wifi"", ""Freezer"", ""Refrigerator"", ""Dishes and silverware"", ""Ethernet connection"", ""Self check-in"", ""Hangers"", ""Long term stays allowed"", ""Essentials"", ""Shampoo"", ""Hot water"", ""Smoking allowed"", ""Barbecue utensils"", ""Luggage dropoff allowed"", ""TV with standard cable"", ""Patio or balcony"", ""Kitchen"", ""Oven"", ""BBQ grill"", ""Stove"", ""Window guards"", ""Fire extinguisher"", ""Room-darkening shades"", ""Free street parking"", ""Microwave"", ""Dedicated workspace"", ""Cooking basics"", ""Hair dryer"", ""Building staff""]",SIN INFORMACION,t,25/09/2024,01/08/2023,SIN INFORMACION,f
9654,49816356.0,1.0,1.0,6.2,7.3,1.0,2.5,1.0,1.0,199.0,1.6,365,30,60,365,2.0,0.0,0.0,5.0,5.0,4.5,5.0,5.0,5.0,5.0,0.05,25/09/2024,Shared Room and Terrace,"You will like my house very much, my house is big and very interesting since there are many foreigners from other countries in the world. The atmosphere is very nice.<br /><br />We are in an excellent location near downtown and next to the Metrobus.",SIN INFORMACION,https://a0.muscache.com/pictures/miso/Hosting-49816356/original/b7f68d97-8343-4a9f-a620-9ad79cb99eed.jpeg,Luis,04/08/2018,"Hello my friends, my house is very big and interesting, I always have guests from different parts of the world and therefore there is a very broad cultural exchange. The location is excellent because the Airport is 15 minutes from here and the downtown too. The Metrobus is around the corner, is very cheap to travel on it.",a few days or more,f,"['email', 'phone']",t,t,SIN INFORMACION,Shared room in home,Shared room,2.5 shared baths,"[""Iron"", ""Washer"", ""Wifi"", ""Freezer"", ""Refrigerator"", ""Dishes and silverware"", ""Ethernet connection"", ""Self check-in"", ""Building staff"", ""Hangers"", ""Long term stays allowed"", ""First aid kit"", ""Essentials"", ""Shampoo"", ""Hot water"", ""Smoking allowed"", ""Barbecue utensils"", ""Luggage dropoff allowed"", ""TV with standard cable"", ""Patio or balcony"", ""Kitchen"", ""Oven"", ""BBQ grill"", ""Stove"", ""Window guards"", ""Fire extinguisher"", ""Room-darkening shades"", ""Free street parking"", ""Exterior security cameras on property"", ""Dedicated workspace"", ""Cooking basics"", ""Hair dryer"", ""Microwave""]",SIN INFORMACION,t,25/09/2024,30/09/2021,SIN INFORMACION,f
9655,49817362.0,1.0,1.0,6.2,7.3,1.0,3.0,1.0,1.0,199.0,1.6,365,30,60,365,1.0,0.0,0.0,5.0,5.0,5.0,5.0,5.0,5.0,5.0,0.03,25/09/2024,Shared Room,"You will like my house very much, my house is big and very interesting since there are many foreigners from other countries in the world. The atmosphere is very nice.<br /><br />We are in an excellent location near downtown and next to the Metrobus.",SIN INFORMACION,https://a0.muscache.com/pictures/miso/Hosting-49817362/original/a6d57d71-cb3a-4d19-949f-d8b9f834f27b.jpeg,Luis,04/08/2018,"Hello my friends, my house is very big and interesting, I always have guests from different parts of the world and therefore there is a very broad cultural exchange. The location is excellent because the Airport is 15 minutes from here and the downtown too. The Metrobus is around the corner, is very cheap to travel on it.",a few days or more,f,"['email', 'phone']",t,t,SIN INFORMACION,Shared room in home,Shared room,3 shared baths,"[""Iron"", ""Washer"", ""Wifi"", ""Refrigerator"", ""Dishes and silverware"", ""Ethernet connection"", ""Self check-in"", ""Hangers"", ""Body soap"", ""Coffee maker"", ""Backyard"", ""Long term stays allowed"", ""First aid kit"", ""Essentials"", ""Shampoo"", ""Hot water"", ""Smoking allowed"", ""Dining table"", ""Dryer"", ""Luggage dropoff allowed"", ""TV"", ""Pocket wifi"", ""Patio or balcony"", ""Bed linens"", ""Kitchen"", ""Drying rack for clothing"", ""Stove"", ""Fire extinguisher"", ""Clothing storage"", ""Free street parking"", ""Microwave"", ""Dedicated workspace"", ""Cooking basics"", ""Hair dryer"", ""Building staff""]",SIN INFORMACION,t,25/09/2024,06/09/2021,SIN INFORMACION,f
9673,50105074.0,1.0,1.0,6.2,7.3,1.0,3.0,1.0,1.0,199.0,1.6,365,30,60,365,1.0,0.0,0.0,5.0,5.0,5.0,5.0,5.0,5.0,5.0,0.03,25/09/2024,Shared Room Near Metrobus,"You will like my house very much, my house is big and very interesting since there are many foreigners from other countries in the world. The atmosphere is very nice.<br /><br />We are in an excellent location near downtown and next to the Metrobus.",SIN INFORMACION,https://a0.muscache.com/pictures/miso/Hosting-47488567/original/8df05bae-38a2-47b2-ad7f-bf92665b5d11.jpeg,Luis,04/08/2018,"Hello my friends, my house is very big and interesting, I always have guests from different parts of the world and therefore there is a very broad cultural exchange. The location is excellent because the Airport is 15 minutes from here and the downtown too. The Metrobus is around the corner, is very cheap to travel on it.",a few days or more,f,"['email', 'phone']",t,t,SIN INFORMACION,Shared room in home,Shared room,3 shared baths,"[""Iron"", ""Washer"", ""Wifi"", ""Refrigerator"", ""Dishes and silverware"", ""Ethernet connection"", ""Self check-in"", ""Hangers"", ""Body soap"", ""Coffee maker"", ""Backyard"", ""Long term stays allowed"", ""First aid kit"", ""Essentials"", ""Shampoo"", ""Hot water"", ""Smoking allowed"", ""Dining table"", ""Dryer"", ""Luggage dropoff allowed"", ""TV"", ""Pocket wifi"", ""Patio or balcony"", ""Bed linens"", ""Kitchen"", ""Drying rack for clothing"", ""Stove"", ""Fire extinguisher"", ""Clothing storage"", ""Free street parking"", ""Microwave"", ""Dedicated workspace"", ""Cooking basics"", ""Hair dryer"", ""Building staff""]",SIN INFORMACION,t,25/09/2024,01/07/2021,SIN INFORMACION,f
9676,50105686.0,1.0,1.0,6.2,7.3,1.0,3.0,1.0,1.0,199.0,1.6,365,30,60,365,0.0,0.0,0.0,4.8,4.8,4.8,4.8,4.8,4.8,4.7,1.7,25/09/2024,Shared Room Near Metrobus,"You will like my house very much, my house is big and very interesting since there are many foreigners from other countries in the world. The atmosphere is very nice.<br /><br />We are in an excellent location near downtown and next to the Metrobus.",SIN INFORMACION,https://a0.muscache.com/pictures/miso/Hosting-47488567/original/8df05bae-38a2-47b2-ad7f-bf92665b5d11.jpeg,Luis,04/08/2018,"Hello my friends, my house is very big and interesting, I always have guests from different parts of the world and therefore there is a very broad cultural exchange. The location is excellent because the Airport is 15 minutes from here and the downtown too. The Metrobus is around the corner, is very cheap to travel on it.",a few days or more,f,"['email', 'phone']",t,t,SIN INFORMACION,Shared room in home,Shared room,3 shared baths,"[""Iron"", ""Washer"", ""Wifi"", ""Refrigerator"", ""Dishes and silverware"", ""Ethernet connection"", ""Self check-in"", ""Hangers"", ""Body soap"", ""Coffee maker"", ""Backyard"", ""Long term stays allowed"", ""First aid kit"", ""Essentials"", ""Shampoo"", ""Hot water"", ""Smoking allowed"", ""Dining table"", ""Dryer"", ""Luggage dropoff allowed"", ""TV"", ""Pocket wifi"", ""Patio or balcony"", ""Bed linens"", ""Kitchen"", ""Drying rack for clothing"", ""Stove"", ""Fire extinguisher"", ""Clothing storage"", ""Free street parking"", ""Microwave"", ""Dedicated workspace"", ""Cooking basics"", ""Hair dryer"", ""Building staff""]",SIN INFORMACION,t,25/09/2024,SIN INFORMACION,SIN INFORMACION,f
9679,50106762.0,1.0,1.0,6.2,7.3,1.0,3.0,1.0,1.0,199.0,1.6,365,30,60,365,0.0,0.0,0.0,4.8,4.8,4.8,4.8,4.8,4.8,4.7,1.7,25/09/2024,Shared Room Near Metrobus,"You will like my house very much, my house is big and very interesting since there are many foreigners from other countries in the world. The atmosphere is very nice.<br /><br />We are in an excellent location near downtown and next to the Metrobus.",SIN INFORMACION,https://a0.muscache.com/pictures/miso/Hosting-47488567/original/8df05bae-38a2-47b2-ad7f-bf92665b5d11.jpeg,Luis,04/08/2018,"Hello my friends, my house is very big and interesting, I always have guests from different parts of the world and therefore there is a very broad cultural exchange. The location is excellent because the Airport is 15 minutes from here and the downtown too. The Metrobus is around the corner, is very cheap to travel on it.",a few days or more,f,"['email', 'phone']",t,t,SIN INFORMACION,Shared room in home,Shared room,3 shared baths,"[""Iron"", ""Washer"", ""Wifi"", ""Refrigerator"", ""Dishes and silverware"", ""Ethernet connection"", ""Self check-in"", ""Hangers"", ""Body soap"", ""Coffee maker"", ""Backyard"", ""Long term stays allowed"", ""First aid kit"", ""Essentials"", ""Shampoo"", ""Hot water"", ""Smoking allowed"", ""Dining table"", ""Dryer"", ""Luggage dropoff allowed"", ""TV"", ""Pocket wifi"", ""Patio or balcony"", ""Bed linens"", ""Kitchen"", ""Drying rack for clothing"", ""Stove"", ""Fire extinguisher"", ""Clothing storage"", ""Free street parking"", ""Microwave"", ""Dedicated workspace"", ""Cooking basics"", ""Hair dryer"", ""Building staff""]",SIN INFORMACION,t,25/09/2024,SIN INFORMACION,SIN INFORMACION,f
