,id,host_response_rate,host_acceptance_rate,host_listings_count,host_total_listings_count,accommodates,bathrooms,bedrooms,beds,price,minimum_nights,maximum_nights,availability_30,availability_60,availability_365,number_of_reviews,number_of_reviews_ltm,number_of_reviews_l30d,review_scores_rating,review_scores_accuracy,review_scores_cleanliness,review_scores_checkin,review_scores_communication,review_scores_location,review_scores_value,reviews_per_month,last_scraped,name,description,neighborhood_overview,picture_url,host_name,host_since,host_about,host_response_time,host_is_superhost,host_verifications,host_has_profile_pic,host_identity_verified,neighbourhood,property_type,room_type,bathrooms_text,amenities,calendar_updated,has_availability,calendar_last_scraped,last_review,license,instant_bookable
21935,1.08e+18,1.0,1.0,13.0,21.0,1.0,3.0,1.0,1.0,346.0,1.0,365,30,60,270,0.0,0.0,0.0,4.8,4.8,4.8,4.8,4.8,4.8,4.7,1.7,25/09/2024,106 Habitación compartida espaciosa 3,"With the central location of this home, you and your loved ones will have it all within easy reach.",SIN INFORMACION,https://a0.muscache.com/pictures/hosting/Hosting-1080699907813025887/original/b305f8ef-0136-4b89-ba22-9d57a27a1f2f.jpeg,Raul,06/12/2023,SIN INFORMACIO,within an hour,f,"['email', 'phone']",t,t,SIN INFORMACION,Shared room in guesthouse,Shared room,3 shared baths,"[""Washer"", ""Wifi"", ""Kitchen"", ""First aid kit"", ""Outdoor dining area"", ""Exterior security cameras on property"", ""Dedicated workspace""]",SIN INFORMACION,t,25/09/2024,SIN INFORMACION,SIN INFORMACION,f
21936,1.08e+18,1.0,1.0,13.0,21.0,1.0,3.0,1.0,1.0,210.0,1.0,365,30,60,270,0.0,0.0,0.0,4.8,4.8,4.8,4.8,4.8,4.8,4.7,1.7,25/09/2024,106 Habitación espaciosa compartida 4,This unique home has plenty of space to enjoy your loved ones.,It is a very quiet and safe neighborhood.,https://a0.muscache.com/pictures/hosting/Hosting-1080699907813025887/original/b305f8ef-0136-4b89-ba22-9d57a27a1f2f.jpeg,Raul,06/12/2023,SIN INFORMACIO,within an hour,f,"['email', 'phone']",t,t,"Mexico City, Ciudad de México, Mexico",Shared room in guesthouse,Shared room,3 shared baths,"[""Washer"", ""Wifi"", ""Kitchen"", ""First aid kit"", ""Outdoor dining area"", ""Exterior security cameras on property"", ""Dedicated workspace""]",SIN INFORMACION,t,25/09/2024,SIN INFORMACION,SIN INFORMACION,f
21937,1.08e+18,1.0,1.0,13.0,21.0,1.0,3.0,1.0,1.0,203.0,1.0,365,29,59,269,2.0,2.0,0.0,5.0,5.0,5.0,5.0,5.0,5.0,5.0,0.28,25/09/2024,106 Habitación espaciosa y cómoda 5,"With the central location of this home, you and your loved ones will have it all within easy reach.",SIN INFORMACION,https://a0.muscache.com/pictures/hosting/Hosting-1080699907813025887/original/b305f8ef-0136-4b89-ba22-9d57a27a1f2f.jpeg,Raul,06/12/2023,SIN INFORMACIO,within an hour,f,"['email', 'phone']",t,t,SIN INFORMACION,Shared room in guesthouse,Shared room,3 shared baths,"[""Washer"", ""Wifi"", ""Kitchen"", ""First aid kit"", ""Outdoor dining area"", ""Exterior security cameras on property"", ""Dedicated workspace""]",SIN INFORMACION,t,25/09/2024,08/05/2024,SIN INFORMACION,f
21938,1.08e+18,1.0,1.0,13.0,21.0,1.0,3.5,1.0,1.0,215.0,1.0,365,30,60,270,0.0,0.0,0.0,4.8,4.8,4.8,4.8,4.8,4.8,4.7,1.7,25/09/2024,106 Habitación espaciosa 6,This stylish place to stay is perfect for group trips.,SIN INFORMACION,https://a0.muscache.com/pictures/hosting/Hosting-1080699907813025887/original/b305f8ef-0136-4b89-ba22-9d57a27a1f2f.jpeg,Raul,06/12/2023,SIN INFORMACIO,within an hour,f,"['email', 'phone']",t,t,SIN INFORMACION,Shared room in guesthouse,Shared room,3.5 shared baths,"[""Washer"", ""Wifi"", ""Kitchen"", ""First aid kit"", ""Outdoor dining area"", ""Exterior security cameras on property"", ""Dedicated workspace""]",SIN INFORMACION,t,25/09/2024,SIN INFORMACION,SIN INFORMACION,f
21939,1.08e+18,1.0,1.0,13.0,21.0,1.0,1.2,1.0,1.0,287.0,1.0,365,30,60,270,0.0,0.0,0.0,4.8,4.8,4.8,4.8,4.8,4.8,4.7,1.7,25/09/2024,106 habitación compartida 7,Enjoy the comfort of this home and film it.,SIN INFORMACION,https://a0.muscache.com/pictures/hosting/Hosting-1080699907813025887/original/b305f8ef-0136-4b89-ba22-9d57a27a1f2f.jpeg,Raul,06/12/2023,SIN INFORMACIO,within an hour,f,"['email', 'phone']",t,t,SIN INFORMACION,Shared room in guesthouse,Shared room,4 shared baths,"[""Washer"", ""Wifi"", ""Kitchen"", ""First aid kit"", ""Outdoor dining area"", ""Exterior security cameras on property"", ""Dedicated workspace""]",SIN INFORMACION,t,25/09/2024,SIN INFORMACION,SIN INFORMACION,f
21940,1.08e+18,1.0,1.0,13.0,21.0,1.0,3.0,1.0,1.0,300.0,1.0,365,0,0,0,3.0,3.0,1.0,5.0,5.0,5.0,5.0,5.0,4.67,5.0,0.38,26/09/2024,106 habitación compartida 8,This stylish place to stay is perfect for group trips.,SIN INFORMACION,https://a0.muscache.com/pictures/hosting/Hosting-1080699907813025887/original/b305f8ef-0136-4b89-ba22-9d57a27a1f2f.jpeg,Raul,06/12/2023,SIN INFORMACIO,within an hour,f,"['email', 'phone']",t,t,SIN INFORMACION,Shared room in guesthouse,Shared room,3 shared baths,"[""Washer"", ""Wifi"", ""Kitchen"", ""First aid kit"", ""Outdoor dining area"", ""Exterior security cameras on property"", ""Dedicated workspace""]",SIN INFORMACION,t,26/09/2024,17/09/2024,SIN INFORMACION,f
21954,1.08e+18,1.0,1.0,13.0,21.0,1.0,3.0,1.0,1.0,356.0,1.0,365,30,60,270,3.0,3.0,0.0,4.8,4.67,4.8,4.9,5.0,4.9,4.8,0.38,25/09/2024,106 habitación compartida 9,This home is strategically located-it will be easy to plan your visit!,SIN INFORMACION,https://a0.muscache.com/pictures/hosting/Hosting-1080699907813025887/original/b305f8ef-0136-4b89-ba22-9d57a27a1f2f.jpeg,Raul,06/12/2023,SIN INFORMACIO,within an hour,f,"['email', 'phone']",t,t,SIN INFORMACION,Shared room in guesthouse,Shared room,3 shared baths,"[""Washer"", ""Wifi"", ""Kitchen"", ""First aid kit"", ""Outdoor dining area"", ""Exterior security cameras on property"", ""Dedicated workspace""]",SIN INFORMACION,t,25/09/2024,26/02/2024,SIN INFORMACION,f
21969,1.08e+18,1.0,1.0,7.0,7.0,7.0,2.0,3.0,1.4,250.0,1.0,365,23,53,358,6.0,6.0,2.0,4.83,4.83,5.0,4.83,5.0,4.83,4.67,0.75,25/09/2024,Hospedaje en CDMX,"Disconnect from your worries in this spacious, cool, safe, and serene space. With the comforts of home, they'll make you feel at ease. Centrally located! with many shopping palaces nearby and metro bus station within walking distance, connecting you to all the metro lines in the city so you can get around fast and safe.",SIN INFORMACION,https://a0.muscache.com/pictures/hosting/Hosting-1077753391353514408/original/e6318ff3-020d-4ccd-b3c5-33a08830c9e6.jpeg,Bellanira Isabel,10/09/2019,"Soy una persona muy amable, atenta, dispuesta a ofrecer un buen servicio como anfitriona en mi casa y fuera de ella ",within an hour,f,"['email', 'phone']",t,t,SIN INFORMACION,Shared room in guesthouse,Shared room,2 shared baths,"[""Iron"", ""Wifi"", ""Freezer"", ""Laundromat nearby"", ""Dishes and silverware"", ""Blender"", ""Portable fans"", ""Hangers"", ""Mini fridge"", ""Long term stays allowed"", ""First aid kit"", ""Hot water"", ""Dining table"", ""TV"", ""Coffee"", ""Bed linens"", ""Kitchen"", ""Other gas stove"", ""Drying rack for clothing"", ""Extra pillows and blankets"", ""Fire extinguisher"", ""Room-darkening shades"", ""Microwave"", ""Cooking basics"", ""Free washer \u2013 In unit""]",SIN INFORMACION,t,25/09/2024,16/09/2024,SIN INFORMACION,t
21979,1.08e+18,1.0,1.0,7.0,7.0,7.0,2.0,1.0,1.4,200.0,1.0,365,29,59,364,4.0,4.0,0.0,5.0,5.0,5.0,5.0,5.0,5.0,5.0,0.73,25/09/2024,Hospedaje Económico en CDMX,"Disconnect from your concerns in this spacious, cool, safe  and serene space. With all the comforts of home, they'll make you feel comfortable. Central! with many commercial palaces nearby and metro bus station, a few steps from the accommodation, that connect you with all the metro lines of the city so you can move quickly and safely. ideal for groups of 4 to 7 maximum people who visit the city for short seasons.","Quiet, safe residential complex with several shopping centers, supermarkets, gyms, parks, banks and restaurants nearby.",https://a0.muscache.com/pictures/hosting/Hosting-U3RheVN1cHBseUxpc3Rpbmc6MTA3NzgwOTg0Mjc1NjkxOTMwMg%3D%3D/original/cac183e7-aafa-4a25-b97d-94e12a22affa.jpeg,Bellanira Isabel,10/09/2019,"Soy una persona muy amable, atenta, dispuesta a ofrecer un buen servicio como anfitriona en mi casa y fuera de ella ",within an hour,f,"['email', 'phone']",t,t,"Mexico City, Ciudad de México, Mexico",Shared room in home,Shared room,2 shared baths,"[""Iron"", ""Washer"", ""Free residential garage on premises \u2013 1 space"", ""Wifi"", ""Freezer"", ""Laundromat nearby"", ""Gas stove"", ""Dishes and silverware"", ""Blender"", ""Portable fans"", ""Hangers"", ""Mini fridge"", ""Long term stays allowed"", ""First aid kit"", ""Hot water"", ""Dining table"", ""TV"", ""Coffee"", ""Bed linens"", ""Kitchen"", ""Oven"", ""Drying rack for clothing"", ""LG refrigerator"", ""Extra pillows and blankets"", ""Fire extinguisher"", ""Room-darkening shades"", ""Microwave"", ""Cooking basics""]",SIN INFORMACION,t,25/09/2024,09/06/2024,SIN INFORMACION,f
22031,1.08e+18,1.0,1.0,6.2,7.3,1.0,2.0,1.0,1.0,200.0,1.6,365,25,55,265,0.0,0.0,0.0,4.8,4.8,4.8,4.8,4.8,4.8,4.7,1.7,25/09/2024,Shared Room in Lindavista Norte,Shared room in Linvavista near Av. Politecnico,SIN INFORMACION,https://a0.muscache.com/pictures/miso/Hosting-973564094413435443/original/60a8b40d-b4f3-435c-ae48-1c096db28669.jpeg,Luis,04/08/2018,"Hello my friends, my house is very big and interesting, I always have guests from different parts of the world and therefore there is a very broad cultural exchange. The location is excellent because the Airport is 15 minutes from here and the downtown too. The Metrobus is around the corner, is very cheap to travel on it.",a few days or more,f,"['email', 'phone']",t,t,SIN INFORMACION,Shared room in guesthouse,Shared room,2 shared baths,"[""Shared patio or balcony"", ""Washer"", ""Wifi"", ""Cooking basics"", ""Fire extinguisher"", ""Bed linens"", ""Kitchen"", ""Hammock"", ""Long term stays allowed"", ""Smoking allowed"", ""Drying rack for clothing"", ""Ping pong table"", ""BBQ grill: charcoal"", ""Shared backyard""]",SIN INFORMACION,t,25/09/2024,SIN INFORMACION,SIN INFORMACION,f
22096,1.08e+18,1.0,1.0,13.0,21.0,1.0,3.0,1.0,1.0,271.0,1.0,365,30,60,270,1.0,1.0,1.0,4.8,4.9,4.8,4.9,4.9,4.9,4.8,1.0,25/09/2024,106 Habitación compartida 1,"Shared room 1 min from metro, very spacious and clean","We are in front of the Metro Tacubaya 6 minutes from Roma, Condesa or Polanco.<br /><br />Tacubaya ceases to be a suburb and integrates with the modernizing process, a very safe area and surrounded by supermarkets, taquerias and tianguis.",https://a0.muscache.com/pictures/hosting/Hosting-1080699907813025887/original/b305f8ef-0136-4b89-ba22-9d57a27a1f2f.jpeg,Raul,06/12/2023,SIN INFORMACIO,within an hour,f,"['email', 'phone']",t,t,"Mexico City, Ciudad de México, Mexico",Shared room in guesthouse,Shared room,3 shared baths,"[""Shared patio or balcony"", ""Wifi"", ""Host greets you"", ""Gas stove"", ""Refrigerator"", ""Dishes and silverware"", ""Paid washer \u2013 In unit"", ""Hammock"", ""Long term stays allowed"", ""First aid kit"", ""Hot water"", ""Luggage dropoff allowed"", ""Bed linens"", ""Kitchen"", ""Outdoor dining area"", ""Extra pillows and blankets"", ""Clothing storage"", ""Room-darkening shades"", ""Exterior security cameras on property"", ""Dedicated workspace"", ""Microwave""]",SIN INFORMACION,t,25/09/2024,16/09/2024,SIN INFORMACION,f
22104,1.08e+18,1.0,1.0,6.2,7.3,1.0,1.2,0.0,1.0,200.0,1.6,365,21,51,261,0.0,0.0,0.0,4.8,4.8,4.8,4.8,4.8,4.8,4.7,1.7,25/09/2024,Shared Room 3 blocks from Tlatelolco Metro,Enjoy easy access to everything from this perfectly located home.,SIN INFORMACION,https://a0.muscache.com/pictures/miso/Hosting-1084429655766226401/original/d51089b4-f5a3-45b2-8417-fc162c5cd70b.jpeg,Luis,04/08/2018,"Hello my friends, my house is very big and interesting, I always have guests from different parts of the world and therefore there is a very broad cultural exchange. The location is excellent because the Airport is 15 minutes from here and the downtown too. The Metrobus is around the corner, is very cheap to travel on it.",a few days or more,f,"['email', 'phone']",t,t,SIN INFORMACION,Shared room in guesthouse,Shared room,5 shared baths,"[""TV"", ""Wifi"", ""Fire extinguisher"", ""Kitchen"", ""Outdoor dining area"", ""Exterior security cameras on property"", ""Dedicated workspace"", ""Smoking allowed""]",SIN INFORMACION,t,25/09/2024,SIN INFORMACION,SIN INFORMACION,f
22188,1.09e+18,1.0,0.98,6.0,7.0,1.0,1.5,1.0,2.0,600.0,1.0,365,0,0,141,0.0,0.0,0.0,4.8,4.8,4.8,4.8,4.8,4.8,4.7,1.7,25/09/2024,“Habitación compartida Centro de Coyoacán”,"Your family will be close to everything if you stay in this centrally located home.<br /><br />Twin bed in bunk bed, bass bed",SIN INFORMACION,https://a0.muscache.com/pictures/8482152c-b30b-4558-9c50-59bdbd346b9d.jpg,Mariela,27/03/2016,"Disfruto mucho saber que mis invitados disfruten su estadía en Coyoacan, se sientan, segur@s y tranquilos como en casa, esta actividad es muy agradable para mi, soy chef de una Dark kitchen
Me apasiona  la Historia conocer culturas ancestrales , la filosofía e idiomas 
Adoro viajar y encontrar restos de la historia, culturas y diferentes leyendas de los pueblos y tradiciones",within an hour,f,"['email', 'phone', 'work_email']",t,t,SIN INFORMACION,Shared room in home,Shared room,1.5 shared baths,"[""Iron"", ""Washer"", ""Wifi"", ""Refrigerator"", ""Dishes and silverware"", ""Self check-in"", ""Coffee maker"", ""Backyard"", ""Breakfast"", ""Long term stays allowed"", ""Essentials"", ""Shampoo"", ""Hot water"", ""Shower gel"", ""Dryer"", ""Luggage dropoff allowed"", ""Patio or balcony"", ""Bed linens"", ""Outdoor dining area"", ""Smoke alarm"", ""Extra pillows and blankets"", ""Free street parking"", ""Microwave"", ""Dedicated workspace"", ""Cooking basics"", ""Lockbox"", ""Paid parking off premises""]",SIN INFORMACION,t,25/09/2024,SIN INFORMACION,SIN INFORMACION,f
22239,1.09e+18,1.0,1.0,7.0,7.0,1.0,1.0,1.0,0.0,333.0,1.0,365,29,59,269,1.0,1.0,0.0,5.0,4.9,4.8,4.9,5.0,5.0,5.0,0.14,25/09/2024,Cama individ habtacion compartda,You will be staying on a single bed in a shared room with up to 7 other guests who like you are backpackers or go to a concert in the Foro Sol,SIN INFORMACION,https://a0.muscache.com/pictures/miso/Hosting-16032189/original/ade2466d-0783-414d-8285-fdaf06e16031.jpeg,Diego,25/09/2016,Soy una persona tranquila que goza de viajar cuando puedo. Trabajo en un hotel asi que me gusta atender a mis huespdes con lo mejor que me han enseñado en mi empleo. Espero  poder ofrecerte algo de tu agrado.,within an hour,f,"['email', 'phone']",t,t,SIN INFORMACION,Shared room in guesthouse,Shared room,1 shared bath,"[""Free parking on premises"", ""Carbon monoxide alarm"", ""Wifi"", ""Patio or balcony"", ""Essentials"", ""Shampoo"", ""Hot water"", ""Pets allowed"", ""Dedicated workspace"", ""Smoke alarm""]",SIN INFORMACION,t,25/09/2024,26/02/2024,SIN INFORMACION,f
22245,1.09e+18,1.0,1.0,7.0,7.0,1.0,1.0,1.0,1.4,299.0,1.0,365,29,59,269,1.0,1.0,0.0,5.0,5.0,5.0,5.0,5.0,5.0,5.0,0.14,25/09/2024,Cama individual  habi compartida,"Accommodation where you will stay in a large room that you share with other travelers or concertgoers, maximo  people in the room",SIN INFORMACION,https://a0.muscache.com/pictures/miso/Hosting-16032189/original/ade2466d-0783-414d-8285-fdaf06e16031.jpeg,Diego,25/09/2016,Soy una persona tranquila que goza de viajar cuando puedo. Trabajo en un hotel asi que me gusta atender a mis huespdes con lo mejor que me han enseñado en mi empleo. Espero  poder ofrecerte algo de tu agrado.,within an hour,f,"['email', 'phone']",t,t,SIN INFORMACION,Shared room in guesthouse,Shared room,1 shared bath,"[""Washer"", ""Carbon monoxide alarm"", ""Wifi"", ""Exterior security cameras on property"", ""Patio or balcony"", ""Outdoor shower"", ""Paid parking on premises"", ""Essentials"", ""Shampoo"", ""Hot water"", ""Pets allowed"", ""Dedicated workspace"", ""Smoke alarm""]",SIN INFORMACION,t,25/09/2024,25/02/2024,SIN INFORMACION,f
22356,1.1e+18,1.0,1.0,5.0,5.0,4.0,1.0,1.0,1.4,321.0,1.0,365,25,55,360,0.0,0.0,0.0,4.8,4.8,4.8,4.8,4.8,4.8,4.7,1.7,25/09/2024,Habitación compartida *Solo Mujeres*,For 4 adults ONLY WOMEN<br />4 single beds<br />Shared bathroom<br />Access to Terrace and roofgarden<br />Shared Kitchen<br />High-Speed WiFi,Centric in CDMX,https://a0.muscache.com/pictures/hosting/Hosting-U3RheVN1cHBseUxpc3Rpbmc6MTA5NzI4MjU1NjgxMDYzNjYzNA%3D%3D/original/fb827a94-e1f7-4e33-a61a-91b0bed1bb50.jpeg,Fernando,22/02/2024,SIN INFORMACIO,within an hour,f,"['email', 'phone']",t,t,"Mexico City, Ciudad de México, Mexico",Shared room in hostel,Shared room,1 shared bath,"[""Wifi"", ""Freezer"", ""Fire extinguisher"", ""City skyline view"", ""Clothing storage"", ""Kitchen"", ""Long term stays allowed"", ""Ethernet connection"", ""Outdoor dining area"", ""Pets allowed"", ""Microwave"", ""Dedicated workspace"", ""Stove""]",SIN INFORMACION,t,25/09/2024,SIN INFORMACION,SIN INFORMACION,t
22358,1.1e+18,1.0,1.0,5.0,5.0,2.9,1.0,1.0,1.4,321.0,1.0,365,30,60,365,2.0,2.0,0.0,4.8,4.9,4.8,4.9,4.9,4.9,4.8,0.43,25/09/2024,Habitación compartida Mixta,For 8 adults<br />4 single bunk beds<br />Shared bathroom<br />Access to Terrace and roofgarden<br />Shared Kitchen<br />High-Speed WiFi,SIN INFORMACION,https://a0.muscache.com/pictures/miso/Hosting-1097293955143646257/original/0601d12f-3f5a-4597-aa0b-3948d889c6d1.jpeg,Fernando,22/02/2024,SIN INFORMACIO,within an hour,f,"['email', 'phone']",t,t,SIN INFORMACION,Shared room in hostel,Shared room,1 shared bath,"[""Wifi"", ""Pocket wifi"", ""Cleaning available during stay"", ""Coffee"", ""Outdoor shower"", ""Bed linens"", ""Kitchen"", ""First aid kit"", ""Essentials"", ""Outdoor dining area"", ""BBQ grill"", ""Hot water"", ""Dedicated workspace"", ""Portable fans""]",SIN INFORMACION,t,25/09/2024,29/06/2024,SIN INFORMACION,t
22487,1.1e+18,1.0,0.99,10.0,12.0,1.0,2.0,1.0,1.0,350.0,1.0,365,25,25,323,5.0,5.0,0.0,4.8,4.6,4.8,4.9,4.6,4.8,4.6,0.81,25/09/2024,"Habitación, la casa del viajero","The traveler's house, central, well connected to public transport, spacious and with everything you need to have a comfortable and economical trip at the same time.<br /><br />You will have the opportunity to meet other guests with whom you can share your stay and experiences.<br /><br />Your room is private and the common areas are shared, we ask you to respect the rest of the guests and the house rules, zero tolerance to whoever breaks the rules, you will be asked to withdraw immediately.",SIN INFORMACION,https://a0.muscache.com/pictures/miso/Hosting-1099612586123301156/original/eba87552-f32e-441c-8009-7de90cff86e3.jpeg,Daniel,24/07/2016,"I'm Daniel, a person who enjoys other people company and explore new cultures,  I'll be happy to host you",within an hour,f,"['email', 'phone']",t,t,SIN INFORMACION,Shared room in home,Shared room,2 shared baths,"[""Extra pillows and blankets"", ""Iron"", ""Cleaning products"", ""Washer"", ""TV"", ""Wifi"", ""Clothing storage"", ""Host greets you"", ""Room-darkening shades"", ""Bed linens"", ""Kitchen"", ""Dishes and silverware"", ""Essentials"", ""Free street parking"", ""Hot water"", ""Drying rack for clothing"", ""Cooking basics"", ""Hangers""]",SIN INFORMACION,t,25/09/2024,26/05/2024,SIN INFORMACION,t
22670,1.11e+18,1.0,1.0,1.0,2.0,6.0,2.0,1.0,1.4,2400.0,1.0,365,29,59,269,0.0,0.0,0.0,4.8,4.8,4.8,4.8,4.8,4.8,4.7,1.7,26/09/2024,Fabuloso departamento,Enjoy the simplicity of this quiet and central home.,SIN INFORMACION,https://a0.muscache.com/pictures/hosting/Hosting-1111807256523256830/original/87a4cea4-2f31-4466-ad46-0c628a404e99.jpeg,Ivan,04/03/2024,SIN INFORMACIO,SIN INFORMACION,f,['phone'],t,t,SIN INFORMACION,Shared room in rental unit,Shared room,2 shared baths,"[""Washer"", ""TV"", ""Wifi"", ""Kitchen"", ""Dedicated workspace""]",SIN INFORMACION,t,26/09/2024,SIN INFORMACION,SIN INFORMACION,f
22684,1.11e+18,1.0,1.0,7.0,9.0,1.0,1.0,1.0,1.4,321.0,1.0,365,30,60,269,2.0,2.0,0.0,5.0,5.0,5.0,5.0,4.5,5.0,5.0,0.31,26/09/2024,Habitación compartida en Condesa,"Shared room with six beds distributed in three beds, next to the terrace, bathroom with shower, has WiFi, fan, six wooden drawers with single key, ideal room for rest, the house has exclusive kitchen for guests, cafeteria with food service and large terrace overlooking the city.",SIN INFORMACION,https://a0.muscache.com/pictures/miso/Hosting-1111887698385033635/original/fc7ec522-dd59-4e65-891e-08dcdc040f60.jpeg,Yula,24/04/2022,"Los invito a conocer y hospedarse en una encantadora casona en la colonia condesa de la Ciudad de México,  el barrio más vanguardista y espectacular de la ciudad, mi propiedad cuenta con cinco habitaciones, sala, comedor, cocina y una terraza con una hermosa vista a la ciudad.",within an hour,t,"['email', 'phone']",t,t,SIN INFORMACION,Shared room in home,Shared room,1 shared bath,"[""Wifi"", ""Indoor fireplace"", ""Fire extinguisher"", ""Kitchen"", ""First aid kit"", ""Outdoor dining area""]",SIN INFORMACION,t,26/09/2024,25/03/2024,SIN INFORMACION,t
22752,1.11e+18,1.0,1.0,13.0,21.0,1.0,1.2,1.0,1.4,300.0,1.0,365,29,59,269,0.0,0.0,0.0,4.8,4.8,4.8,4.8,4.8,4.8,4.7,1.7,25/09/2024,Sólo chicas habitación compartida,This stylish place is great for group trips.,SIN INFORMACION,https://a0.muscache.com/pictures/hosting/Hosting-1080699907813025887/original/b305f8ef-0136-4b89-ba22-9d57a27a1f2f.jpeg,Raul,06/12/2023,SIN INFORMACIO,within an hour,f,"['email', 'phone']",t,t,SIN INFORMACION,Shared room in guesthouse,Shared room,4 shared baths,"[""Washer"", ""Wifi"", ""Kitchen"", ""First aid kit"", ""Outdoor dining area"", ""Exterior security cameras on property"", ""Dedicated workspace""]",SIN INFORMACION,t,25/09/2024,SIN INFORMACION,SIN INFORMACION,f
22768,1.11e+18,1.0,1.0,13.0,21.0,1.0,1.2,1.0,1.4,300.0,1.0,365,29,59,269,0.0,0.0,0.0,4.8,4.8,4.8,4.8,4.8,4.8,4.7,1.7,25/09/2024,Sólo chicas habitación compartida,From this centrally located accommodation the whole group can have easy access to everything.,SIN INFORMACION,https://a0.muscache.com/pictures/hosting/Hosting-1080699907813025887/original/b305f8ef-0136-4b89-ba22-9d57a27a1f2f.jpeg,Raul,06/12/2023,SIN INFORMACIO,within an hour,f,"['email', 'phone']",t,t,SIN INFORMACION,Shared room in guesthouse,Shared room,4 shared baths,"[""Washer"", ""Wifi"", ""Kitchen"", ""First aid kit"", ""Outdoor dining area"", ""Exterior security cameras on property"", ""Dedicated workspace""]",SIN INFORMACION,t,25/09/2024,SIN INFORMACION,SIN INFORMACION,f
22797,1.12e+18,1.0,1.0,1.0,1.0,2.0,2.0,1.0,0.0,360.0,1.0,365,30,60,270,0.0,0.0,0.0,4.8,4.8,4.8,4.8,4.8,4.8,4.7,1.7,25/09/2024,Loft,SIN INFORMACION,SIN INFORMACION,https://a0.muscache.com/pictures/hosting/Hosting-1115370607962601497/original/894df060-141a-468b-879a-8c2c761415f2.jpeg,Arturo,18/03/2024,SIN INFORMACIO,a few days or more,f,['phone'],f,t,SIN INFORMACION,Shared room in home,Shared room,2 shared baths,"[""Wifi"", ""Kitchen"", ""Outdoor dining area"", ""Exterior security cameras on property"", ""Dedicated workspace"", ""Smoking allowed""]",SIN INFORMACION,SIN INFORMACION,25/09/2024,SIN INFORMACION,SIN INFORMACION,f
22939,1.12e+18,1.0,0.98,6.2,7.3,2.0,2.5,1.0,1.0,146.0,1.0,365,25,55,265,4.0,4.0,0.0,5.0,4.9,4.5,4.75,4.75,5.0,5.0,0.68,26/09/2024,Habitación Compartida Condesa,"Habitcon shared in the countess.<br /><br />the room has 9 beds , the price is per person must select the number of people who will arrive in order to block the nights. <br /><br />the house has  <br />equipped kitchen<br />wifi<br />2.5 bathrooms<br />terrace<br />hot water",SIN INFORMACION,https://a0.muscache.com/pictures/miso/Hosting-823966034103686485/original/112527e4-9088-4d85-a600-9e1dc505bb12.jpeg,Andrea,14/09/2017,"Anfitriona en Airnbn desde hace 6 años , encantada de recibir huéspedes a mi casa o mis espacios. Dedicada en brindarles toda la ayuda que esté en mis manos para hacer su viaje lo más agradable posible ",within an hour,SIN INFORMACION,"['email', 'phone']",t,t,SIN INFORMACION,Shared room in home,Shared room,2.5 shared baths,"[""Wifi"", ""Kitchen"", ""Self check-in"", ""Outdoor dining area"", ""Cooking basics"", ""Lockbox""]",SIN INFORMACION,t,26/09/2024,17/08/2024,SIN INFORMACION,t
23090,1.13e+18,1.0,0.98,6.2,7.3,4.0,2.5,1.0,1.0,146.0,1.0,365,30,60,270,2.0,2.0,0.0,5.0,5.0,5.0,5.0,5.0,5.0,5.0,0.42,26/09/2024,Habitacion compartida en casa,Shared room in Condesa <br /><br />shared room in Condesa<br /><br /><br />wifi <br /><br />equipped kitchen<br /><br />2.5 bathroom<br /><br />towel<br /><br />hot water,SIN INFORMACION,https://a0.muscache.com/pictures/miso/Hosting-54181226/original/a3e344cc-fcb6-4c96-a983-9128cd0fb502.jpeg,Andrea,14/09/2017,"Anfitriona en Airnbn desde hace 6 años , encantada de recibir huéspedes a mi casa o mis espacios. Dedicada en brindarles toda la ayuda que esté en mis manos para hacer su viaje lo más agradable posible ",within an hour,SIN INFORMACION,"['email', 'phone']",t,t,SIN INFORMACION,Shared room in home,Shared room,2.5 shared baths,"[""Iron"", ""Wifi"", ""Laundromat nearby"", ""Bikes"", ""Dishes and silverware"", ""Self check-in"", ""Backyard"", ""Long term stays allowed"", ""Essentials"", ""Hot water"", ""Patio or balcony"", ""Bed linens"", ""Kitchen"", ""Outdoor dining area"", ""Smoke alarm"", ""Stove"", ""Extra pillows and blankets"", ""Cooking basics"", ""Dedicated workspace"", ""Smoking allowed"", ""Lockbox""]",SIN INFORMACION,t,26/09/2024,09/05/2024,SIN INFORMACION,t
